ions [nop,nop,TS val 2999222397 ecr 1341586639], length 224
03:57:34.103495 IP 159.89.117.68.22 > 162.243.188.66.56371: Flags [P.], seq 3617937:3618161, ack 64, win 502, options [nop,nop,TS val 2999222397 ecr 1341586639], length 224
03:57:34.103776 IP 159.89.117.68.22 > 162.243.188.66.56371: Flags [P.], seq 3618161:3618385, ack 64, win 502, options [nop,nop,TS val 2999222397 ecr 1341586639], length 224
03:57:34.103923 IP 162.243.188.66.56371 > 159.89.117.68.22: Flags [.], ack 3590705, win 5467, options [nop,nop,TS val 1341586640 ecr 2999222378], length 0
03:57:34.104106 IP 159.89.117.68.22 > 162.243.188.66.56371: Flags [P.], seq 3618385:3618769, ack 64, win 502, options [nop,nop,TS val 2999222397 ecr 1341586640], length 384
03:57:34.104292 IP 159.89.117.68.22 > 162.243.188.66.56371: Flags [P.], seq 3618769:3618993, ack 64, win 502, options [nop,nop,TS val 2999222398 ecr 1341586640], length 224
03:57:34.104458 IP 159.89.117.68.22 > 162.243.188.66.56371: Flags [P.], seq 3618993:3619217, ack 64, win 502, options [nop,nop,TS val 2999222398 ecr 1341586640], length 224
03:57:34.104608 IP 162.243.188.66.56371 > 159.89.117.68.22: Flags [.], ack 3592369, win 5467, options [nop,nop,TS val 1341586641 ecr 2999222379], length 0
03:57:34.104784 IP 159.89.117.68.22 > 162.243.188.66.56371: Flags [P.], seq 3619217:3619601, ack 64, win 502, options [nop,nop,TS val 2999222398 ecr 1341586641], length 384
03:57:34.104989 IP 159.89.117.68.22 > 162.243.188.66.56371: Flags [P.], seq 3619601:3619825, ack 64, win 502, options [nop,nop,TS val 2999222398 ecr 1341586641], length 224
03:57:34.105237 IP 159.89.117.68.22 > 162.243.188.66.56371: Flags [P.], seq 3619825:3620049, ack 64, win 502, options [nop,nop,TS val 2999222399 ecr 1341586641], length 224
03:57:34.105393 IP 159.89.117.68.22 > 162.243.188.66.56371: Flags [P.], seq 3620049:3620273, ack 64, win 502, options [nop,nop,TS val 2999222399 ecr 1341586641], length 224
03:57:34.105542 IP 159.89.117.68.22 > 162.243.188.66.56371: Flags [P.], seq 3620273:3620497, ack 64, win 502, options [nop,nop,TS val 2999222399 ecr 1341586641], length 224
03:57:34.105682 IP 159.89.117.68.22 > 162.243.188.66.56371: Flags [P.], seq 3620497:3620721, ack 64, win 502, options [nop,nop,TS val 2999222399 ecr 1341586641], length 224
03:57:34.105867 IP 159.89.117.68.22 > 162.243.188.66.56371: Flags [P.], seq 3620721:3620945, ack 64, win 502, options [nop,nop,TS val 2999222399 ecr 1341586641], length 224
03:57:34.105933 IP 162.243.188.66.56371 > 159.89.117.68.22: Flags [.], ack 3593873, win 5467, options [nop,nop,TS val 1341586642 ecr 2999222380], length 0
03:57:34.106148 IP 159.89.117.68.22 > 162.243.188.66.56371: Flags [P.], seq 3620945:3621329, ack 64, win 502, options [nop,nop,TS val 2999222399 ecr 1341586642], length 384
03:57:34.106346 IP 159.89.117.68.22 > 162.243.188.66.56371: Flags [P.], seq 3621329:3621553, ack 64, win 502, options [nop,nop,TS val 2999222400 ecr 1341586642], length 224
03:57:34.106513 IP 159.89.117.68.22 > 162.243.188.66.56371: Flags [P.], seq 3621553:3621777, ack 64, win 502, options [nop,nop,TS val 2999222400 ecr 1341586642], length 224
03:57:34.106681 IP 159.89.117.68.22 > 162.243.188.66.56371: Flags [P.], seq 3621777:3622001, ack 64, win 502, options [nop,nop,TS val 2999222400 ecr 1341586642], length 224
03:57:34.106818 IP 159.89.117.68.22 > 162.243.188.66.56371: Flags [P.], seq 3622001:3622225, ack 64, win 502, options [nop,nop,TS val 2999222400 ecr 1341586642], length 224
03:57:34.106948 IP 159.89.117.68.22 > 162.243.188.66.56371: Flags [P.], seq 3622225:3622449, ack 64, win 502, options [nop,nop,TS val 2999222400 ecr 1341586642], length 224
03:57:34.107084 IP 159.89.117.68.22 > 162.243.188.66.56371: Flags [P.], seq 3622449:3622673, ack 64, win 502, options [nop,nop,TS val 2999222400 ecr 1341586642], length 224
03:57:34.107270 IP 159.89.117.68.22 > 162.243.188.66.56371: Flags [P.], seq 3622673:3622897, ack 64, win 502, options [nop,nop,TS val 2999222401 ecr 1341586642], length 224
03:57:34.107430 IP 159.89.117.68.22 > 162.243.188.66.56371: Flags [P.], seq 3622897:3623121, ack 64, win 502, options [nop,nop,TS val 2999222401 ecr 1341586642], length 224
03:57:34.107564 IP 159.89.117.68.22 > 162.243.188.66.56371: Flags [P.], seq 3623121:3623345, ack 64, win 502, options [nop,nop,TS val 2999222401 ecr 1341586642], length 224
03:57:34.107731 IP 159.89.117.68.22 > 162.243.188.66.56371: Flags [P.], seq 3623345:3623569, ack 64, win 502, options [nop,nop,TS val 2999222401 ecr 1341586642], length 224
03:57:34.107803 IP 162.243.188.66.56371 > 159.89.117.68.22: Flags [.], ack 3595377, win 5467, options [nop,nop,TS val 1341586644 ecr 2999222380], length 0
03:57:34.107955 IP 159.89.117.68.22 > 162.243.188.66.56371: Flags [P.], seq 3623569:3623953, ack 64, win 502, options [nop,nop,TS val 2999222401 ecr 1341586644], length 384
03:57:34.108110 IP 159.89.117.68.22 > 162.243.188.66.56371: Flags [P.], seq 3623953:3624177, ack 64, win 502, options [nop,nop,TS val 2999222401 ecr 1341586644], length 224
03:57:34.108285 IP 159.89.117.68.22 > 162.243.188.66.56371: Flags [P.], seq 3624177:3624401, ack 64, win 502, options [nop,nop,TS val 2999222402 ecr 1341586644], length 224
03:57:34.108539 IP 159.89.117.68.22 > 162.243.188.66.56371: Flags [P.], seq 3624401:3624625, ack 64, win 502, options [nop,nop,TS val 2999222402 ecr 1341586644], length 224
03:57:34.108657 IP 162.243.188.66.56371 > 159.89.117.68.22: Flags [.], ack 3597041, win 5467, options [nop,nop,TS val 1341586644 ecr 2999222381], length 0
03:57:34.108782 IP 159.89.117.68.22 > 162.243.188.66.56371: Flags [P.], seq 3624625:3625009, ack 64, win 502, options [nop,nop,TS val 2999222402 ecr 1341586644], length 384
03:57:34.108921 IP 159.89.117.68.22 > 162.243.188.66.56371: Flags [P.], seq 3625009:3625233, ack 64, win 502, options [nop,nop,TS val 2999222402 ecr 1341586644], length 224
03:57:34.109060 IP 159.89.117.68.22 > 162.243.188.66.56371: Flags [P.], seq 3625233:3625457, ack 64, win 502, options [nop,nop,TS val 2999222402 ecr 1341586644], length 224
03:57:34.109272 IP 162.243.188.66.56371 > 159.89.117.68.22: Flags [.], ack 3598609, win 5467, options [nop,nop,TS val 1341586645 ecr 2999222382], length 0
03:57:34.109301 IP 159.89.117.68.22 > 162.243.188.66.56371: Flags [P.], seq 3625457:3625681, ack 64, win 502, options [nop,nop,TS val 2999222403 ecr 1341586644], length 224
03:57:34.109482 IP 159.89.117.68.22 > 162.243.188.66.56371: Flags [P.], seq 3625681:3626065, ack 64, win 502, options [nop,nop,TS val 2999222403 ecr 1341586645], length 384
03:57:34.109625 IP 159.89.117.68.22 > 162.243.188.66.56371: Flags [P.], seq 3626065:3626289, ack 64, win 502, options [nop,nop,TS val 2999222403 ecr 1341586645], length 224
03:57:34.109774 IP 159.89.117.68.22 > 162.243.188.66.56371: Flags [P.], seq 3626289:3626513, ack 64, win 502, options [nop,nop,TS val 2999222403 ecr 1341586645], length 224
03:57:34.109825 IP 162.243.188.66.56371 > 159.89.117.68.22: Flags [.], ack 3600177, win 5467, options [nop,nop,TS val 1341586646 ecr 2999222383], length 0
03:57:34.110020 IP 159.89.117.68.22 > 162.243.188.66.56371: Flags [P.], seq 3626513:3626897, ack 64, win 502, options [nop,nop,TS val 2999222403 ecr 1341586646], length 384
03:57:34.110164 IP 159.89.117.68.22 > 162.243.188.66.56371: Flags [P.], seq 3626897:3627121, ack 64, win 502, options [nop,nop,TS val 2999222404 ecr 1341586646], length 224
03:57:34.110473 IP 159.89.117.68.22 > 162.243.188.66.56371: Flags [P.], seq 3627121:3627345, ack 64, win 502, options [nop,nop,TS val 2999222404 ecr 1341586646], length 224
03:57:34.110648 IP 159.89.117.68.22 > 162.243.188.66.56371: Flags [P.], seq 3627345:3627569, ack 64, win 502, options [nop,nop,TS val 2999222404 ecr 1341586646], length 224
03:57:34.110811 IP 159.89.117.68.22 > 162.243.188.66.56371: Flags [P.], seq 3627569:3627793, ack 64, win 502, options [nop,nop,TS val 2999222404 ecr 1341586646], length 224
03:57:34.111005 IP 162.243.188.66.56371 > 159.89.117.68.22: Flags [.], ack 3601841, win 5467, options [nop,nop,TS val 1341586647 ecr 2999222384], length 0
03:57:34.111143 IP 159.89.117.68.22 > 162.243.188.66.56371: Flags [P.], seq 3627793:3628177, ack 64, win 502, options [nop,nop,TS val 2999222404 ecr 1341586647], length 384
03:57:34.111315 IP 159.89.117.68.22 > 162.243.188.66.56371: Flags [P.], seq 3628177:3628401, ack 64, win 502, options [nop,nop,TS val 2999222405 ecr 1341586647], length 224
03:57:34.111545 IP 159.89.117.68.22 > 162.243.188.66.56371: Flags [P.], seq 3628401:3628625, ack 64, win 502, options [nop,nop,TS val 2999222405 ecr 1341586647], length 224
03:57:34.111792 IP 159.89.117.68.22 > 162.243.188.66.56371: Flags [P.], seq 3628625:3628849, ack 64, win 502, options [nop,nop,TS val 2999222405 ecr 1341586647], length 224
03:57:34.111978 IP 159.89.117.68.22 > 162.243.188.66.56371: Flags [P.], seq 3628849:3629073, ack 64, win 502, options [nop,nop,TS val 2999222405 ecr 1341586647], length 224
03:57:34.112151 IP 159.89.117.68.22 > 162.243.188.66.56371: Flags [P.], seq 3629073:3629297, ack 64, win 502, options [nop,nop,TS val 2999222405 ecr 1341586647], length 224
03:57:34.112386 IP 159.89.117.68.22 > 162.243.188.66.56371: Flags [P.], seq 3629297:3629521, ack 64, win 502, options [nop,nop,TS val 2999222406 ecr 1341586647], length 224
03:57:34.112574 IP 159.89.117.68.22 > 162.243.188.66.56371: Flags [P.], seq 3629521:3629745, ack 64, win 502, options [nop,nop,TS val 2999222406 ecr 1341586647], length 224
03:57:34.112726 IP 159.89.117.68.22 > 162.243.188.66.56371: Flags [P.], seq 3629745:3629969, ack 64, win 502, options [nop,nop,TS val 2999222406 ecr 1341586647], length 224
03:57:34.112860 IP 159.89.117.68.22 > 162.243.188.66.56371: Flags [P.], seq 3629969:3630193, ack 64, win 502, options [nop,nop,TS val 2999222406 ecr 1341586647], length 224
03:57:34.112922 IP 162.243.188.66.56371 > 159.89.117.68.22: Flags [.], ack 3603409, win 5467, options [nop,nop,TS val 1341586649 ecr 2999222385], length 0
03:57:34.113065 IP 159.89.117.68.22 > 162.243.188.66.56371: Flags [P.], seq 3630193:3630577, ack 64, win 502, options [nop,nop,TS val 2999222406 ecr 1341586649], length 384
03:57:34.113269 IP 162.243.188.66.56371 > 159.89.117.68.22: Flags [.], ack 3604913, win 5467, options [nop,nop,TS val 1341586649 ecr 2999222386], length 0
03:57:34.113454 IP 159.89.117.68.22 > 162.243.188.66.56371: Flags [P.], seq 3630577:3630801, ack 64, win 502, options [nop,nop,TS val 2999222407 ecr 1341586649], length 224
03:57:34.113658 IP 159.89.117.68.22 > 162.243.188.66.56371: Flags [P.], seq 3630801:3631009, ack 64, win 502, options [nop,nop,TS val 2999222407 ecr 1341586649], length 208
03:57:34.113731 IP 159.89.117.68.22 > 162.243.188.66.56371: Flags [P.], seq 3631009:3631233, ack 64, win 502, options [nop,nop,TS val 2999222407 ecr 1341586649], length 224
03:57:34.113798 IP 162.243.188.66.56371 > 159.89.117.68.22: Flags [.], ack 3606481, win 5467, options [nop,nop,TS val 1341586649 ecr 2999222387], length 0
03:57:34.113958 IP 159.89.117.68.22 > 162.243.188.66.56371: Flags [P.], seq 3631233:3631793, ack 64, win 502, options [nop,nop,TS val 2999222407 ecr 1341586649], length 560
03:57:34.114106 IP 159.89.117.68.22 > 162.243.188.66.56371: Flags [P.], seq 3631793:3632017, ack 64, win 502, options [nop,nop,TS val 2999222407 ecr 1341586649], length 224
03:57:34.114246 IP 159.89.117.68.22 > 162.243.188.66.56371: Flags [P.], seq 3632017:3632241, ack 64, win 502, options [nop,nop,TS val 2999222408 ecr 1341586649], length 224
03:57:34.114428 IP 159.89.117.68.22 > 162.243.188.66.56371: Flags [P.], seq 3632241:3632465, ack 64, win 502, options [nop,nop,TS val 2999222408 ecr 1341586649], length 224
03:57:34.114532 IP 162.243.188.66.56371 > 159.89.117.68.22: Flags [.], ack 3607985, win 5467, options [nop,nop,TS val 1341586651 ecr 2999222388], length 0
03:57:34.114648 IP 159.89.117.68.22 > 162.243.188.66.56371: Flags [P.], seq 3632465:3632849, ack 64, win 502, options [nop,nop,TS val 2999222408 ecr 1341586651], length 384
03:57:34.115076 IP 162.243.188.66.56371 > 159.89.117.68.22: Flags [.], ack 3609489, win 5467, options [nop,nop,TS val 1341586652 ecr 2999222389], length 0
03:57:34.115153 IP 159.89.117.68.22 > 162.243.188.66.56371: Flags [P.], seq 3632849:3633073, ack 64, win 502, options [nop,nop,TS val 2999222409 ecr 1341586651], length 224
03:57:34.115270 IP 159.89.117.68.22 > 162.243.188.66.56371: Flags [P.], seq 3633073:3633281, ack 64, win 502, options [nop,nop,TS val 2999222409 ecr 1341586652], length 208
03:57:34.115466 IP 159.89.117.68.22 > 162.243.188.66.56371: Flags [P.], seq 3633281:3633681, ack 64, win 502, options [nop,nop,TS val 2999222409 ecr 1341586652], length 400
03:57:34.115644 IP 159.89.117.68.22 > 162.243.188.66.56371: Flags [P.], seq 3633681:3633905, ack 64, win 502, options [nop,nop,TS val 2999222409 ecr 1341586652], length 224
03:57:34.115786 IP 159.89.117.68.22 > 162.243.188.66.56371: Flags [P.], seq 3633905:3634129, ack 64, win 502, options [nop,nop,TS val 2999222409 ecr 1341586652], length 224
03:57:34.115918 IP 159.89.117.68.22 > 162.243.188.66.56371: Flags [P.], seq 3634129:3634353, ack 64, win 502, options [nop,nop,TS val 2999222409 ecr 1341586652], length 224
03:57:34.116049 IP 159.89.117.68.22 > 162.243.188.66.56371: Flags [P.], seq 3634353:3634577, ack 64, win 502, options [nop,nop,TS val 2999222409 ecr 1341586652], length 224
03:57:34.116180 IP 159.89.117.68.22 > 162.243.188.66.56371: Flags [P.], seq 3634577:3634801, ack 64, win 502, options [nop,nop,TS val 2999222410 ecr 1341586652], length 224
03:57:34.116360 IP 159.89.117.68.22 > 162.243.188.66.56371: Flags [P.], seq 3634801:3635025, ack 64, win 502, options [nop,nop,TS val 2999222410 ecr 1341586652], length 224
03:57:34.116538 IP 159.89.117.68.22 > 162.243.188.66.56371: Flags [P.], seq 3635025:3635249, ack 64, win 502, options [nop,nop,TS val 2999222410 ecr 1341586652], length 224
03:57:34.116567 IP 162.243.188.66.56371 > 159.89.117.68.22: Flags [.], ack 3611057, win 5467, options [nop,nop,TS val 1341586653 ecr 2999222389], length 0
03:57:34.116732 IP 159.89.117.68.22 > 162.243.188.66.56371: Flags [P.], seq 3635249:3635633, ack 64, win 502, options [nop,nop,TS val 2999222410 ecr 1341586653], length 384
03:57:34.116870 IP 159.89.117.68.22 > 162.243.188.66.56371: Flags [P.], seq 3635633:3635857, ack 64, win 502, options [nop,nop,TS val 2999222410 ecr 1341586653], length 224
03:57:34.117000 IP 159.89.117.68.22 > 162.243.188.66.56371: Flags [P.], seq 3635857:3636081, ack 64, win 502, options [nop,nop,TS val 2999222410 ecr 1341586653], length 224
03:57:34.117129 IP 159.89.117.68.22 > 162.243.188.66.56371: Flags [P.], seq 3636081:3636305, ack 64, win 502, options [nop,nop,TS val 2999222410 ecr 1341586653], length 224
03:57:34.117261 IP 159.89.117.68.22 > 162.243.188.66.56371: Flags [P.], seq 3636305:3636529, ack 64, win 502, options [nop,nop,TS val 2999222411 ecr 1341586653], length 224
03:57:34.117395 IP 159.89.117.68.22 > 162.243.188.66.56371: Flags [P.], seq 3636529:3636753, ack 64, win 502, options [nop,nop,TS val 2999222411 ecr 1341586653], length 224
03:57:34.117527 IP 159.89.117.68.22 > 162.243.188.66.56371: Flags [P.], seq 3636753:3636977, ack 64, win 502, options [nop,nop,TS val 2999222411 ecr 1341586653], length 224
03:57:34.117644 IP 162.243.188.66.56371 > 159.89.117.68.22: Flags [.], ack 3612881, win 5467, options [nop,nop,TS val 1341586654 ecr 2999222390], length 0
03:57:34.117711 IP 159.89.117.68.22 > 162.243.188.66.56371: Flags [P.], seq 3636977:3637201, ack 64, win 502, options [nop,nop,TS val 2999222411 ecr 1341586654], length 224
03:57:34.117875 IP 159.89.117.68.22 > 162.243.188.66.56371: Flags [P.], seq 3637201:3637585, ack 64, win 502, options [nop,nop,TS val 2999222411 ecr 1341586654], length 384
03:57:34.118006 IP 159.89.117.68.22 > 162.243.188.66.56371: Flags [P.], seq 3637585:3637809, ack 64, win 502, options [nop,nop,TS val 2999222411 ecr 1341586654], length 224
03:57:34.118094 IP 162.243.188.66.56371 > 159.89.117.68.22: Flags [.], ack 3614449, win 5467, options [nop,nop,TS val 1341586654 ecr 2999222392], length 0
03:57:34.118209 IP 159.89.117.68.22 > 162.243.188.66.56371: Flags [P.], seq 3637809:3638193, ack 64, win 502, options [nop,nop,TS val 2999222412 ecr 1341586654], length 384
03:57:34.118344 IP 159.89.117.68.22 > 162.243.188.66.56371: Flags [P.], seq 3638193:3638417, ack 64, win 502, options [nop,nop,TS val 2999222412 ecr 1341586654], length 224
03:57:34.118471 IP 159.89.117.68.22 > 162.243.188.66.56371: Flags [P.], seq 3638417:3638641, ack 64, win 502, options [nop,nop,TS val 2999222412 ecr 1341586654], length 224
03:57:34.118600 IP 159.89.117.68.22 > 162.243.188.66.56371: Flags [P.], seq 3638641:3638865, ack 64, win 502, options [nop,nop,TS val 2999222412 ecr 1341586654], length 224
03:57:34.118736 IP 159.89.117.68.22 > 162.243.188.66.56371: Flags [P.], seq 3638865:3639089, ack 64, win 502, options [nop,nop,TS val 2999222412 ecr 1341586654], length 224
03:57:34.118940 IP 162.243.188.66.56371 > 159.89.117.68.22: Flags [.], ack 3616049, win 5467, options [nop,nop,TS val 1341586655 ecr 2999222393], length 0
03:57:34.119068 IP 159.89.117.68.22 > 162.243.188.66.56371: Flags [P.], seq 3639089:3639313, ack 64, win 502, options [nop,nop,TS val 2999222412 ecr 1341586655], length 224
03:57:34.119317 IP 159.89.117.68.22 > 162.243.188.66.56371: Flags [P.], seq 3639313:3639697, ack 64, win 502, options [nop,nop,TS val 2999222413 ecr 1341586655], length 384
03:57:34.119515 IP 159.89.117.68.22 > 162.243.188.66.56371: Flags [P.], seq 3639697:3639921, ack 64, win 502, options [nop,nop,TS val 2999222413 ecr 1341586655], length 224
03:57:34.119741 IP 159.89.117.68.22 > 162.243.188.66.56371: Flags [P.], seq 3639921:3640145, ack 64, win 502, options [nop,nop,TS val 2999222413 ecr 1341586655], length 224
03:57:34.119935 IP 159.89.117.68.22 > 162.243.188.66.56371: Flags [P.], seq 3640145:3640369, ack 64, win 502, options [nop,nop,TS val 2999222413 ecr 1341586655], length 224
03:57:34.120127 IP 159.89.117.68.22 > 162.243.188.66.56371: Flags [P.], seq 3640369:3640593, ack 64, win 502, options [nop,nop,TS val 2999222413 ecr 1341586655], length 224
03:57:34.120323 IP 159.89.117.68.22 > 162.243.188.66.56371: Flags [P.], seq 3640593:3640817, ack 64, win 502, options [nop,nop,TS val 2999222414 ecr 1341586655], length 224
03:57:34.120553 IP 159.89.117.68.22 > 162.243.188.66.56371: Flags [P.], seq 3640817:3641041, ack 64, win 502, options [nop,nop,TS val 2999222414 ecr 1341586655], length 224
03:57:34.120762 IP 159.89.117.68.22 > 162.243.188.66.56371: Flags [P.], seq 3641041:3641265, ack 64, win 502, options [nop,nop,TS val 2999222414 ecr 1341586655], length 224
03:57:34.120957 IP 159.89.117.68.22 > 162.243.188.66.56371: Flags [P.], seq 3641265:3641489, ack 64, win 502, options [nop,nop,TS val 2999222414 ecr 1341586655], length 224
03:57:34.121145 IP 159.89.117.68.22 > 162.243.188.66.56371: Flags [P.], seq 3641489:3641713, ack 64, win 502, options [nop,nop,TS val 2999222414 ecr 1341586655], length 224
03:57:34.121336 IP 159.89.117.68.22 > 162.243.188.66.56371: Flags [P.], seq 3641713:3641937, ack 64, win 502, options [nop,nop,TS val 2999222415 ecr 1341586655], length 224
03:57:34.121549 IP 159.89.117.68.22 > 162.243.188.66.56371: Flags [P.], seq 3641937:3642161, ack 64, win 502, options [nop,nop,TS val 2999222415 ecr 1341586655], length 224
03:57:34.121744 IP 159.89.117.68.22 > 162.243.188.66.56371: Flags [P.], seq 3642161:3642385, ack 64, win 502, options [nop,nop,TS val 2999222415 ecr 1341586655], length 224
03:57:34.121935 IP 159.89.117.68.22 > 162.243.188.66.56371: Flags [P.], seq 3642385:3642609, ack 64, win 502, options [nop,nop,TS val 2999222415 ecr 1341586655], length 224
03:57:34.122128 IP 159.89.117.68.22 > 162.243.188.66.56371: Flags [P.], seq 3642609:3642833, ack 64, win 502, options [nop,nop,TS val 2999222415 ecr 1341586655], length 224
03:57:34.122351 IP 159.89.117.68.22 > 162.243.188.66.56371: Flags [P.], seq 3642833:3643057, ack 64, win 502, options [nop,nop,TS val 2999222416 ecr 1341586655], length 224
03:57:34.122540 IP 159.89.117.68.22 > 162.243.188.66.56371: Flags [P.], seq 3643057:3643281, ack 64, win 502, options [nop,nop,TS val 2999222416 ecr 1341586655], length 224
03:57:34.122692 IP 162.243.188.66.56371 > 159.89.117.68.22: Flags [.], ack 3617713, win 5467, options [nop,nop,TS val 1341586658 ecr 2999222394], length 0
03:57:34.122795 IP 159.89.117.68.22 > 162.243.188.66.56371: Flags [P.], seq 3643281:3643505, ack 64, win 502, options [nop,nop,TS val 2999222416 ecr 1341586658], length 224
03:57:34.123025 IP 159.89.117.68.22 > 162.243.188.66.56371: Flags [P.], seq 3643505:3643889, ack 64, win 502, options [nop,nop,TS val 2999222416 ecr 1341586658], length 384
03:57:34.123220 IP 159.89.117.68.22 > 162.243.188.66.56371: Flags [P.], seq 3643889:3644113, ack 64, win 502, options [nop,nop,TS val 2999222417 ecr 1341586658], length 224
03:57:34.123409 IP 159.89.117.68.22 > 162.243.188.66.56371: Flags [P.], seq 3644113:3644337, ack 64, win 502, options [nop,nop,TS val 2999222417 ecr 1341586658], length 224
03:57:34.123626 IP 159.89.117.68.22 > 162.243.188.66.56371: Flags [P.], seq 3644337:3644561, ack 64, win 502, options [nop,nop,TS val 2999222417 ecr 1341586658], length 224
03:57:34.123819 IP 159.89.117.68.22 > 162.243.188.66.56371: Flags [P.], seq 3644561:3644785, ack 64, win 502, options [nop,nop,TS val 2999222417 ecr 1341586658], length 224
03:57:34.124018 IP 159.89.117.68.22 > 162.243.188.66.56371: Flags [P.], seq 3644785:3645009, ack 64, win 502, options [nop,nop,TS val 2999222417 ecr 1341586658], length 224
03:57:34.124212 IP 159.89.117.68.22 > 162.243.188.66.56371: Flags [P.], seq 3645009:3645233, ack 64, win 502, options [nop,nop,TS val 2999222418 ecr 1341586658], length 224
03:57:34.124400 IP 159.89.117.68.22 > 162.243.188.66.56371: Flags [P.], seq 3645233:3645457, ack 64, win 502, options [nop,nop,TS val 2999222418 ecr 1341586658], length 224
03:57:34.124635 IP 159.89.117.68.22 > 162.243.188.66.56371: Flags [P.], seq 3645457:3645681, ack 64, win 502, options [nop,nop,TS val 2999222418 ecr 1341586658], length 224
03:57:34.124833 IP 159.89.117.68.22 > 162.243.188.66.56371: Flags [P.], seq 3645681:3645905, ack 64, win 502, options [nop,nop,TS val 2999222418 ecr 1341586658], length 224
03:57:34.124912 IP 162.243.188.66.56371 > 159.89.117.68.22: Flags [.], ack 3619217, win 5467, options [nop,nop,TS val 1341586660 ecr 2999222397], length 0
03:57:34.125115 IP 159.89.117.68.22 > 162.243.188.66.56371: Flags [P.], seq 3645905:3646289, ack 64, win 502, options [nop,nop,TS val 2999222418 ecr 1341586660], length 384
03:57:34.125324 IP 159.89.117.68.22 > 162.243.188.66.56371: Flags [P.], seq 3646289:3646513, ack 64, win 502, options [nop,nop,TS val 2999222419 ecr 1341586660], length 224
03:57:34.125517 IP 159.89.117.68.22 > 162.243.188.66.56371: Flags [P.], seq 3646513:3646737, ack 64, win 502, options [nop,nop,TS val 2999222419 ecr 1341586660], length 224
03:57:34.125711 IP 159.89.117.68.22 > 162.243.188.66.56371: Flags [P.], seq 3646737:3646961, ack 64, win 502, options [nop,nop,TS val 2999222419 ecr 1341586660], length 224
03:57:34.125906 IP 159.89.117.68.22 > 162.243.188.66.56371: Flags [P.], seq 3646961:3647185, ack 64, win 502, options [nop,nop,TS val 2999222419 ecr 1341586660], length 224
03:57:34.126114 IP 159.89.117.68.22 > 162.243.188.66.56371: Flags [P.], seq 3647185:3647409, ack 64, win 502, options [nop,nop,TS val 2999222419 ecr 1341586660], length 224
03:57:34.126318 IP 159.89.117.68.22 > 162.243.188.66.56371: Flags [P.], seq 3647409:3647633, ack 64, win 502, options [nop,nop,TS val 2999222420 ecr 1341586660], length 224
03:57:34.126497 IP 162.243.188.66.56371 > 159.89.117.68.22: Flags [.], ack 3620721, win 5467, options [nop,nop,TS val 1341586662 ecr 2999222398], length 0
03:57:34.126668 IP 159.89.117.68.22 > 162.243.188.66.56371: Flags [P.], seq 3647633:3647857, ack 64, win 502, options [nop,nop,TS val 2999222420 ecr 1341586662], length 224
03:57:34.126855 IP 159.89.117.68.22 > 162.243.188.66.56371: Flags [P.], seq 3647857:3648065, ack 64, win 502, options [nop,nop,TS val 2999222420 ecr 1341586662], length 208
03:57:34.127033 IP 159.89.117.68.22 > 162.243.188.66.56371: Flags [P.], seq 3648065:3648289, ack 64, win 502, options [nop,nop,TS val 2999222420 ecr 1341586662], length 224
03:57:34.127214 IP 159.89.117.68.22 > 162.243.188.66.56371: Flags [P.], seq 3648289:3648513, ack 64, win 502, options [nop,nop,TS val 2999222421 ecr 1341586662], length 224
03:57:34.127308 IP 159.89.117.68.22 > 162.243.188.66.56371: Flags [P.], seq 3648513:3648737, ack 64, win 502, options [nop,nop,TS val 2999222421 ecr 1341586662], length 224
03:57:34.127519 IP 162.243.188.66.56371 > 159.89.117.68.22: Flags [.], ack 3622225, win 5467, options [nop,nop,TS val 1341586663 ecr 2999222399], length 0
03:57:34.127726 IP 159.89.117.68.22 > 162.243.188.66.56371: Flags [P.], seq 3648737:3649137, ack 64, win 502, options [nop,nop,TS val 2999222421 ecr 1341586663], length 400
03:57:34.127908 IP 159.89.117.68.22 > 162.243.188.66.56371: Flags [P.], seq 3649137:3649345, ack 64, win 502, options [nop,nop,TS val 2999222421 ecr 1341586663], length 208
03:57:34.128092 IP 159.89.117.68.22 > 162.243.188.66.56371: Flags [P.], seq 3649345:3649569, ack 64, win 502, options [nop,nop,TS val 2999222421 ecr 1341586663], length 224
03:57:34.128284 IP 162.243.188.66.56371 > 159.89.117.68.22: Flags [.], ack 3623953, win 5467, options [nop,nop,TS val 1341586665 ecr 2999222400], length 0
03:57:34.128312 IP 159.89.117.68.22 > 162.243.188.66.56371: Flags [P.], seq 3649569:3649793, ack 64, win 502, options [nop,nop,TS val 2999222422 ecr 1341586663], length 224
03:57:34.128414 IP 159.89.117.68.22 > 162.243.188.66.56371: Flags [P.], seq 3649793:3650017, ack 64, win 502, options [nop,nop,TS val 2999222422 ecr 1341586665], length 224
03:57:34.128710 IP 159.89.117.68.22 > 162.243.188.66.56371: Flags [P.], seq 3650017:3650577, ack 64, win 502, options [nop,nop,TS val 2999222422 ecr 1341586665], length 560
03:57:34.128850 IP 162.243.188.66.56371 > 159.89.117.68.22: Flags [.], ack 3625457, win 5467, options [nop,nop,TS val 1341586665 ecr 2999222401], length 0
03:57:34.129022 IP 159.89.117.68.22 > 162.243.188.66.56371: Flags [P.], seq 3650577:3650961, ack 64, win 502, options [nop,nop,TS val 2999222422 ecr 1341586665], length 384
03:57:34.129217 IP 159.89.117.68.22 > 162.243.188.66.56371: Flags [P.], seq 3650961:3651185, ack 64, win 502, options [nop,nop,TS val 2999222423 ecr 1341586665], length 224
03:57:34.129322 IP 162.243.188.66.56371 > 159.89.117.68.22: Flags [.], ack 3627121, win 5467, options [nop,nop,TS val 1341586666 ecr 2999222403], length 0
03:57:34.129517 IP 159.89.117.68.22 > 162.243.188.66.56371: Flags [P.], seq 3651185:3651569, ack 64, win 502, options [nop,nop,TS val 2999222423 ecr 1341586666], length 384
03:57:34.129744 IP 159.89.117.68.22 > 162.243.188.66.56371: Flags [P.], seq 3651569:3651793, ack 64, win 502, options [nop,nop,TS val 2999222423 ecr 1341586666], length 224
03:57:34.129949 IP 159.89.117.68.22 > 162.243.188.66.56371: Flags [P.], seq 3651793:3652017, ack 64, win 502, options [nop,nop,TS val 2999222423 ecr 1341586666], length 224
03:57:34.130139 IP 159.89.117.68.22 > 162.243.188.66.56371: Flags [P.], seq 3652017:3652241, ack 64, win 502, options [nop,nop,TS val 2999222423 ecr 1341586666], length 224
03:57:34.130324 IP 159.89.117.68.22 > 162.243.188.66.56371: Flags [P.], seq 3652241:3652465, ack 64, win 502, options [nop,nop,TS val 2999222424 ecr 1341586666], length 224
03:57:34.130396 IP 162.243.188.66.56371 > 159.89.117.68.22: Flags [.], ack 3628625, win 5467, options [nop,nop,TS val 1341586667 ecr 2999222404], length 0
03:57:34.130611 IP 159.89.117.68.22 > 162.243.188.66.56371: Flags [P.], seq 3652465:3652849, ack 64, win 502, options [nop,nop,TS val 2999222424 ecr 1341586667], length 384
03:57:34.130808 IP 159.89.117.68.22 > 162.243.188.66.56371: Flags [P.], seq 3652849:3653073, ack 64, win 502, options [nop,nop,TS val 2999222424 ecr 1341586667], length 224
03:57:34.130998 IP 159.89.117.68.22 > 162.243.188.66.56371: Flags [P.], seq 3653073:3653297, ack 64, win 502, options [nop,nop,TS val 2999222424 ecr 1341586667], length 224
03:57:34.131188 IP 159.89.117.68.22 > 162.243.188.66.56371: Flags [P.], seq 3653297:3653521, ack 64, win 502, options [nop,nop,TS val 2999222425 ecr 1341586667], length 224
03:57:34.131376 IP 159.89.117.68.22 > 162.243.188.66.56371: Flags [P.], seq 3653521:3653745, ack 64, win 502, options [nop,nop,TS val 2999222425 ecr 1341586667], length 224
03:57:34.131622 IP 159.89.117.68.22 > 162.243.188.66.56371: Flags [P.], seq 3653745:3653969, ack 64, win 502, options [nop,nop,TS val 2999222425 ecr 1341586667], length 224
03:57:34.131707 IP 162.243.188.66.56371 > 159.89.117.68.22: Flags [.], ack 3630193, win 5467, options [nop,nop,TS val 1341586668 ecr 2999222405], length 0
03:57:34.131926 IP 159.89.117.68.22 > 162.243.188.66.56371: Flags [P.], seq 3653969:3654353, ack 64, win 502, options [nop,nop,TS val 2999222425 ecr 1341586668], length 384
03:57:34.132136 IP 159.89.117.68.22 > 162.243.188.66.56371: Flags [P.], seq 3654353:3654577, ack 64, win 502, options [nop,nop,TS val 2999222425 ecr 1341586668], length 224
03:57:34.132291 IP 162.243.188.66.56371 > 159.89.117.68.22: Flags [.], ack 3631793, win 5467, options [nop,nop,TS val 1341586669 ecr 2999222406], length 0
03:57:34.132390 IP 159.89.117.68.22 > 162.243.188.66.56371: Flags [P.], seq 3654577:3654801, ack 64, win 502, options [nop,nop,TS val 2999222426 ecr 1341586669], length 224
03:57:34.132666 IP 159.89.117.68.22 > 162.243.188.66.56371: Flags [P.], seq 3654801:3655185, ack 64, win 502, options [nop,nop,TS val 2999222426 ecr 1341586669], length 384
03:57:34.132889 IP 159.89.117.68.22 > 162.243.188.66.56371: Flags [P.], seq 3655185:3655409, ack 64, win 502, options [nop,nop,TS val 2999222426 ecr 1341586669], length 224
03:57:34.133080 IP 159.89.117.68.22 > 162.243.188.66.56371: Flags [P.], seq 3655409:3655633, ack 64, win 502, options [nop,nop,TS val 2999222426 ecr 1341586669], length 224
03:57:34.133271 IP 159.89.117.68.22 > 162.243.188.66.56371: Flags [P.], seq 3655633:3655857, ack 64, win 502, options [nop,nop,TS val 2999222427 ecr 1341586669], length 224
03:57:34.133463 IP 159.89.117.68.22 > 162.243.188.66.56371: Flags [P.], seq 3655857:3656081, ack 64, win 502, options [nop,nop,TS val 2999222427 ecr 1341586669], length 224
03:57:34.133656 IP 159.89.117.68.22 > 162.243.188.66.56371: Flags [P.], seq 3656081:3656305, ack 64, win 502, options [nop,nop,TS val 2999222427 ecr 1341586669], length 224
03:57:34.133858 IP 159.89.117.68.22 > 162.243.188.66.56371: Flags [P.], seq 3656305:3656529, ack 64, win 502, options [nop,nop,TS val 2999222427 ecr 1341586669], length 224
03:57:34.134050 IP 159.89.117.68.22 > 162.243.188.66.56371: Flags [P.], seq 3656529:3656753, ack 64, win 502, options [nop,nop,TS val 2999222427 ecr 1341586669], length 224
03:57:34.134250 IP 159.89.117.68.22 > 162.243.188.66.56371: Flags [P.], seq 3656753:3656977, ack 64, win 502, options [nop,nop,TS val 2999222428 ecr 1341586669], length 224
03:57:34.134391 IP 162.243.188.66.56371 > 159.89.117.68.22: Flags [.], ack 3633281, win 5467, options [nop,nop,TS val 1341586670 ecr 2999222407], length 0
03:57:34.134607 IP 159.89.117.68.22 > 162.243.188.66.56371: Flags [P.], seq 3656977:3657361, ack 64, win 502, options [nop,nop,TS val 2999222428 ecr 1341586670], length 384
03:57:34.134823 IP 159.89.117.68.22 > 162.243.188.66.56371: Flags [P.], seq 3657361:3657585, ack 64, win 502, options [nop,nop,TS val 2999222428 ecr 1341586670], length 224
03:57:34.135029 IP 159.89.117.68.22 > 162.243.188.66.56371: Flags [P.], seq 3657585:3657809, ack 64, win 502, options [nop,nop,TS val 2999222428 ecr 1341586670], length 224
03:57:34.135230 IP 159.89.117.68.22 > 162.243.188.66.56371: Flags [P.], seq 3657809:3658033, ack 64, win 502, options [nop,nop,TS val 2999222429 ecr 1341586670], length 224
03:57:34.135419 IP 159.89.117.68.22 > 162.243.188.66.56371: Flags [P.], seq 3658033:3658257, ack 64, win 502, options [nop,nop,TS val 2999222429 ecr 1341586670], length 224
03:57:34.135649 IP 159.89.117.68.22 > 162.243.188.66.56371: Flags [P.], seq 3658257:3658481, ack 64, win 502, options [nop,nop,TS val 2999222429 ecr 1341586670], length 224
03:57:34.135797 IP 162.243.188.66.56371 > 159.89.117.68.22: Flags [.], ack 3634801, win 5467, options [nop,nop,TS val 1341586671 ecr 2999222409], length 0
03:57:34.135905 IP 159.89.117.68.22 > 162.243.188.66.56371: Flags [P.], seq 3658481:3658705, ack 64, win 502, options [nop,nop,TS val 2999222429 ecr 1341586671], length 224
03:57:34.136141 IP 159.89.117.68.22 > 162.243.188.66.56371: Flags [P.], seq 3658705:3659089, ack 64, win 502, options [nop,nop,TS val 2999222429 ecr 1341586671], length 384
03:57:34.136337 IP 159.89.117.68.22 > 162.243.188.66.56371: Flags [P.], seq 3659089:3659313, ack 64, win 502, options [nop,nop,TS val 2999222430 ecr 1341586671], length 224
03:57:34.136562 IP 159.89.117.68.22 > 162.243.188.66.56371: Flags [P.], seq 3659313:3659537, ack 64, win 502, options [nop,nop,TS val 2999222430 ecr 1341586671], length 224
03:57:34.136755 IP 159.89.117.68.22 > 162.243.188.66.56371: Flags [P.], seq 3659537:3659761, ack 64, win 502, options [nop,nop,TS val 2999222430 ecr 1341586671], length 224
03:57:34.136950 IP 159.89.117.68.22 > 162.243.188.66.56371: Flags [P.], seq 3659761:3659985, ack 64, win 502, options [nop,nop,TS val 2999222430 ecr 1341586671], length 224
03:57:34.137146 IP 159.89.117.68.22 > 162.243.188.66.56371: Flags [P.], seq 3659985:3660209, ack 64, win 502, options [nop,nop,TS val 2999222430 ecr 1341586671], length 224
03:57:34.137341 IP 159.89.117.68.22 > 162.243.188.66.56371: Flags [P.], seq 3660209:3660433, ack 64, win 502, options [nop,nop,TS val 2999222431 ecr 1341586671], length 224
03:57:34.137532 IP 159.89.117.68.22 > 162.243.188.66.56371: Flags [P.], seq 3660433:3660657, ack 64, win 502, options [nop,nop,TS val 2999222431 ecr 1341586671], length 224
03:57:34.137735 IP 159.89.117.68.22 > 162.243.188.66.56371: Flags [P.], seq 3660657:3660881, ack 64, win 502, options [nop,nop,TS val 2999222431 ecr 1341586671], length 224
03:57:34.137927 IP 159.89.117.68.22 > 162.243.188.66.56371: Flags [P.], seq 3660881:3661105, ack 64, win 502, options [nop,nop,TS val 2999222431 ecr 1341586671], length 224
03:57:34.138017 IP 162.243.188.66.56371 > 159.89.117.68.22: Flags [.], ack 3636305, win 5467, options [nop,nop,TS val 1341586674 ecr 2999222410], length 0
03:57:34.138238 IP 159.89.117.68.22 > 162.243.188.66.56371: Flags [P.], seq 3661105:3661489, ack 64, win 502, options [nop,nop,TS val 2999222432 ecr 1341586674], length 384
03:57:34.138444 IP 159.89.117.68.22 > 162.243.188.66.56371: Flags [P.], seq 3661489:3661713, ack 64, win 502, options [nop,nop,TS val 2999222432 ecr 1341586674], length 224
03:57:34.138647 IP 159.89.117.68.22 > 162.243.188.66.56371: Flags [P.], seq 3661713:3661937, ack 64, win 502, options [nop,nop,TS val 2999222432 ecr 1341586674], length 224
03:57:34.138856 IP 159.89.117.68.22 > 162.243.188.66.56371: Flags [P.], seq 3661937:3662161, ack 64, win 502, options [nop,nop,TS val 2999222432 ecr 1341586674], length 224
03:57:34.138906 IP 162.243.188.66.56371 > 159.89.117.68.22: Flags [.], ack 3637809, win 5467, options [nop,nop,TS val 1341586674 ecr 2999222411], length 0
03:57:34.139142 IP 159.89.117.68.22 > 162.243.188.66.56371: Flags [P.], seq 3662161:3662545, ack 64, win 502, options [nop,nop,TS val 2999222432 ecr 1341586674], length 384
03:57:34.139366 IP 162.243.188.66.56371 > 159.89.117.68.22: Flags [.], ack 3639313, win 5467, options [nop,nop,TS val 1341586675 ecr 2999222412], length 0
03:57:34.139392 IP 159.89.117.68.22 > 162.243.188.66.56371: Flags [P.], seq 3662545:3662769, ack 64, win 502, options [nop,nop,TS val 2999222433 ecr 1341586674], length 224
03:57:34.139658 IP 159.89.117.68.22 > 162.243.188.66.56371: Flags [P.], seq 3662769:3663153, ack 64, win 502, options [nop,nop,TS val 2999222433 ecr 1341586675], length 384
03:57:34.139858 IP 159.89.117.68.22 > 162.243.188.66.56371: Flags [P.], seq 3663153:3663377, ack 64, win 502, options [nop,nop,TS val 2999222433 ecr 1341586675], length 224
03:57:34.140052 IP 159.89.117.68.22 > 162.243.188.66.56371: Flags [P.], seq 3663377:3663601, ack 64, win 502, options [nop,nop,TS val 2999222433 ecr 1341586675], length 224
03:57:34.140159 IP 162.243.188.66.56371 > 159.89.117.68.22: Flags [.], ack 3640817, win 5467, options [nop,nop,TS val 1341586676 ecr 2999222413], length 0
03:57:34.140358 IP 159.89.117.68.22 > 162.243.188.66.56371: Flags [P.], seq 3663601:3663985, ack 64, win 502, options [nop,nop,TS val 2999222434 ecr 1341586676], length 384
03:57:34.140607 IP 159.89.117.68.22 > 162.243.188.66.56371: Flags [P.], seq 3663985:3664209, ack 64, win 502, options [nop,nop,TS val 2999222434 ecr 1341586676], length 224
03:57:34.140802 IP 159.89.117.68.22 > 162.243.188.66.56371: Flags [P.], seq 3664209:3664433, ack 64, win 502, options [nop,nop,TS val 2999222434 ecr 1341586676], length 224
03:57:34.140990 IP 159.89.117.68.22 > 162.243.188.66.56371: Flags [P.], seq 3664433:3664657, ack 64, win 502, options [nop,nop,TS val 2999222434 ecr 1341586676], length 224
03:57:34.141181 IP 159.89.117.68.22 > 162.243.188.66.56371: Flags [P.], seq 3664657:3664881, ack 64, win 502, options [nop,nop,TS val 2999222435 ecr 1341586676], length 224
03:57:34.141419 IP 159.89.117.68.22 > 162.243.188.66.56371: Flags [P.], seq 3664881:3665105, ack 64, win 502, options [nop,nop,TS val 2999222435 ecr 1341586676], length 224
03:57:34.141631 IP 159.89.117.68.22 > 162.243.188.66.56371: Flags [P.], seq 3665105:3665329, ack 64, win 502, options [nop,nop,TS val 2999222435 ecr 1341586676], length 224
03:57:34.141850 IP 159.89.117.68.22 > 162.243.188.66.56371: Flags [P.], seq 3665329:3665553, ack 64, win 502, options [nop,nop,TS val 2999222435 ecr 1341586676], length 224
03:57:34.142002 IP 162.243.188.66.56371 > 159.89.117.68.22: Flags [.], ack 3642385, win 5467, options [nop,nop,TS val 1341586678 ecr 2999222414], length 0
03:57:34.142164 IP 159.89.117.68.22 > 162.243.188.66.56371: Flags [P.], seq 3665553:3665937, ack 64, win 502, options [nop,nop,TS val 2999222436 ecr 1341586678], length 384
03:57:34.142358 IP 159.89.117.68.22 > 162.243.188.66.56371: Flags [P.], seq 3665937:3666161, ack 64, win 502, options [nop,nop,TS val 2999222436 ecr 1341586678], length 224
03:57:34.142544 IP 159.89.117.68.22 > 162.243.188.66.56371: Flags [P.], seq 3666161:3666385, ack 64, win 502, options [nop,nop,TS val 2999222436 ecr 1341586678], length 224
03:57:34.142727 IP 159.89.117.68.22 > 162.243.188.66.56371: Flags [P.], seq 3666385:3666609, ack 64, win 502, options [nop,nop,TS val 2999222436 ecr 1341586678], length 224
03:57:34.142915 IP 159.89.117.68.22 > 162.243.188.66.56371: Flags [P.], seq 3666609:3666833, ack 64, win 502, options [nop,nop,TS val 2999222436 ecr 1341586678], length 224
03:57:34.142976 IP 162.243.188.66.56371 > 159.89.117.68.22: Flags [.], ack 3643889, win 5467, options [nop,nop,TS val 1341586679 ecr 2999222415], length 0
03:57:34.143179 IP 159.89.117.68.22 > 162.243.188.66.56371: Flags [P.], seq 3666833:3667217, ack 64, win 502, options [nop,nop,TS val 2999222437 ecr 1341586679], length 384
03:57:34.143374 IP 159.89.117.68.22 > 162.243.188.66.56371: Flags [P.], seq 3667217:3667441, ack 64, win 502, options [nop,nop,TS val 2999222437 ecr 1341586679], length 224
03:57:34.143567 IP 159.89.117.68.22 > 162.243.188.66.56371: Flags [P.], seq 3667441:3667665, ack 64, win 502, options [nop,nop,TS val 2999222437 ecr 1341586679], length 224
03:57:34.143774 IP 159.89.117.68.22 > 162.243.188.66.56371: Flags [P.], seq 3667665:3667889, ack 64, win 502, options [nop,nop,TS val 2999222437 ecr 1341586679], length 224
03:57:34.143945 IP 162.243.188.66.56371 > 159.89.117.68.22: Flags [.], ack 3645457, win 5467, options [nop,nop,TS val 1341586680 ecr 2999222417], length 0
03:57:34.144126 IP 159.89.117.68.22 > 162.243.188.66.56371: Flags [P.], seq 3667889:3668273, ack 64, win 502, options [nop,nop,TS val 2999222437 ecr 1341586680], length 384
03:57:34.144311 IP 159.89.117.68.22 > 162.243.188.66.56371: Flags [P.], seq 3668273:3668497, ack 64, win 502, options [nop,nop,TS val 2999222438 ecr 1341586680], length 224
03:57:34.144490 IP 159.89.117.68.22 > 162.243.188.66.56371: Flags [P.], seq 3668497:3668721, ack 64, win 502, options [nop,nop,TS val 2999222438 ecr 1341586680], length 224
03:57:34.144700 IP 159.89.117.68.22 > 162.243.188.66.56371: Flags [P.], seq 3668721:3668945, ack 64, win 502, options [nop,nop,TS val 2999222438 ecr 1341586680], length 224
03:57:34.144883 IP 159.89.117.68.22 > 162.243.188.66.56371: Flags [P.], seq 3668945:3669169, ack 64, win 502, options [nop,nop,TS val 2999222438 ecr 1341586680], length 224
03:57:34.145067 IP 159.89.117.68.22 > 162.243.188.66.56371: Flags [P.], seq 3669169:3669393, ack 64, win 502, options [nop,nop,TS val 2999222438 ecr 1341586680], length 224
03:57:34.145254 IP 159.89.117.68.22 > 162.243.188.66.56371: Flags [P.], seq 3669393:3669617, ack 64, win 502, options [nop,nop,TS val 2999222439 ecr 1341586680], length 224
03:57:34.145437 IP 159.89.117.68.22 > 162.243.188.66.56371: Flags [P.], seq 3669617:3669841, ack 64, win 502, options [nop,nop,TS val 2999222439 ecr 1341586680], length 224
03:57:34.145651 IP 162.243.188.66.56371 > 159.89.117.68.22: Flags [.], ack 3646961, win 5467, options [nop,nop,TS val 1341586681 ecr 2999222418], length 0
03:57:34.145682 IP 159.89.117.68.22 > 162.243.188.66.56371: Flags [P.], seq 3669841:3670065, ack 64, win 502, options [nop,nop,TS val 2999222439 ecr 1341586680], length 224
03:57:34.145929 IP 159.89.117.68.22 > 162.243.188.66.56371: Flags [P.], seq 3670065:3670449, ack 64, win 502, options [nop,nop,TS val 2999222439 ecr 1341586681], length 384
03:57:34.146136 IP 159.89.117.68.22 > 162.243.188.66.56371: Flags [P.], seq 3670449:3670673, ack 64, win 502, options [nop,nop,TS val 2999222439 ecr 1341586681], length 224
03:57:34.146353 IP 159.89.117.68.22 > 162.243.188.66.56371: Flags [P.], seq 3670673:3670897, ack 64, win 502, options [nop,nop,TS val 2999222440 ecr 1341586681], length 224
03:57:34.146506 IP 159.89.117.68.22 > 162.243.188.66.56371: Flags [P.], seq 3670897:3671121, ack 64, win 502, options [nop,nop,TS val 2999222440 ecr 1341586681], length 224
03:57:34.146648 IP 162.243.188.66.56371 > 159.89.117.68.22: Flags [.], ack 3648513, win 5467, options [nop,nop,TS val 1341586683 ecr 2999222419], length 0
03:57:34.146756 IP 159.89.117.68.22 > 162.243.188.66.56371: Flags [P.], seq 3671121:3671345, ack 64, win 502, options [nop,nop,TS val 2999222440 ecr 1341586683], length 224
03:57:34.146830 IP 159.89.117.68.22 > 162.243.188.66.56371: Flags [P.], seq 3671345:3671553, ack 64, win 502, options [nop,nop,TS val 2999222440 ecr 1341586683], length 208
03:57:34.146987 IP 159.89.117.68.22 > 162.243.188.66.56371: Flags [P.], seq 3671553:3671953, ack 64, win 502, options [nop,nop,TS val 2999222440 ecr 1341586683], length 400
03:57:34.147129 IP 159.89.117.68.22 > 162.243.188.66.56371: Flags [P.], seq 3671953:3672177, ack 64, win 502, options [nop,nop,TS val 2999222440 ecr 1341586683], length 224
03:57:34.147269 IP 159.89.117.68.22 > 162.243.188.66.56371: Flags [P.], seq 3672177:3672401, ack 64, win 502, options [nop,nop,TS val 2999222441 ecr 1341586683], length 224
03:57:34.147407 IP 159.89.117.68.22 > 162.243.188.66.56371: Flags [P.], seq 3672401:3672625, ack 64, win 502, options [nop,nop,TS val 2999222441 ecr 1341586683], length 224
03:57:34.147538 IP 159.89.117.68.22 > 162.243.188.66.56371: Flags [P.], seq 3672625:3672849, ack 64, win 502, options [nop,nop,TS val 2999222441 ecr 1341586683], length 224
03:57:34.147705 IP 159.89.117.68.22 > 162.243.188.66.56371: Flags [P.], seq 3672849:3673073, ack 64, win 502, options [nop,nop,TS val 2999222441 ecr 1341586683], length 224
03:57:34.147844 IP 159.89.117.68.22 > 162.243.188.66.56371: Flags [P.], seq 3673073:3673297, ack 64, win 502, options [nop,nop,TS val 2999222441 ecr 1341586683], length 224
03:57:34.147995 IP 159.89.117.68.22 > 162.243.188.66.56371: Flags [P.], seq 3673297:3673521, ack 64, win 502, options [nop,nop,TS val 2999222441 ecr 1341586683], length 224
03:57:34.148134 IP 159.89.117.68.22 > 162.243.188.66.56371: Flags [P.], seq 3673521:3673745, ack 64, win 502, options [nop,nop,TS val 2999222441 ecr 1341586683], length 224
03:57:34.148330 IP 162.243.188.66.56371 > 159.89.117.68.22: Flags [.], ack 3650017, win 5467, options [nop,nop,TS val 1341586684 ecr 2999222421], length 0
03:57:34.148439 IP 159.89.117.68.22 > 162.243.188.66.56371: Flags [P.], seq 3673745:3673969, ack 64, win 502, options [nop,nop,TS val 2999222442 ecr 1341586683], length 224
03:57:34.148625 IP 159.89.117.68.22 > 162.243.188.66.56371: Flags [P.], seq 3673969:3674353, ack 64, win 502, options [nop,nop,TS val 2999222442 ecr 1341586684], length 384
03:57:34.148880 IP 159.89.117.68.22 > 162.243.188.66.56371: Flags [P.], seq 3674353:3674577, ack 64, win 502, options [nop,nop,TS val 2999222442 ecr 1341586684], length 224
03:57:34.149084 IP 159.89.117.68.22 > 162.243.188.66.56371: Flags [P.], seq 3674577:3674801, ack 64, win 502, options [nop,nop,TS val 2999222442 ecr 1341586684], length 224
03:57:34.149267 IP 159.89.117.68.22 > 162.243.188.66.56371: Flags [P.], seq 3674801:3675025, ack 64, win 502, options [nop,nop,TS val 2999222443 ecr 1341586684], length 224
03:57:34.149861 IP 159.89.117.68.22 > 162.243.188.66.56371: Flags [P.], seq 3675025:3675249, ack 64, win 502, options [nop,nop,TS val 2999222443 ecr 1341586684], length 224
03:57:34.150041 IP 162.243.188.66.56371 > 159.89.117.68.22: Flags [.], ack 3651569, win 5467, options [nop,nop,TS val 1341586685 ecr 2999222422], length 0
03:57:34.150241 IP 159.89.117.68.22 > 162.243.188.66.56371: Flags [P.], seq 3675249:3675633, ack 64, win 502, options [nop,nop,TS val 2999222444 ecr 1341586685], length 384
03:57:34.150445 IP 159.89.117.68.22 > 162.243.188.66.56371: Flags [P.], seq 3675633:3675857, ack 64, win 502, options [nop,nop,TS val 2999222444 ecr 1341586685], length 224
03:57:34.150644 IP 159.89.117.68.22 > 162.243.188.66.56371: Flags [P.], seq 3675857:3676081, ack 64, win 502, options [nop,nop,TS val 2999222444 ecr 1341586685], length 224
03:57:34.150868 IP 159.89.117.68.22 > 162.243.188.66.56371: Flags [P.], seq 3676081:3676305, ack 64, win 502, options [nop,nop,TS val 2999222444 ecr 1341586685], length 224
03:57:34.151079 IP 159.89.117.68.22 > 162.243.188.66.56371: Flags [P.], seq 3676305:3676529, ack 64, win 502, options [nop,nop,TS val 2999222444 ecr 1341586685], length 224
03:57:34.151212 IP 162.243.188.66.56371 > 159.89.117.68.22: Flags [.], ack 3653073, win 5467, options [nop,nop,TS val 1341586686 ecr 2999222423], length 0
03:57:34.151381 IP 159.89.117.68.22 > 162.243.188.66.56371: Flags [P.], seq 3676529:3676913, ack 64, win 502, options [nop,nop,TS val 2999222445 ecr 1341586686], length 384
03:57:34.151653 IP 159.89.117.68.22 > 162.243.188.66.56371: Flags [P.], seq 3676913:3677137, ack 64, win 502, options [nop,nop,TS val 2999222445 ecr 1341586686], length 224
03:57:34.151864 IP 159.89.117.68.22 > 162.243.188.66.56371: Flags [P.], seq 3677137:3677361, ack 64, win 502, options [nop,nop,TS val 2999222445 ecr 1341586686], length 224
03:57:34.151906 IP 162.243.188.66.56371 > 159.89.117.68.22: Flags [.], ack 3654577, win 5467, options [nop,nop,TS val 1341586688 ecr 2999222424], length 0
03:57:34.152144 IP 159.89.117.68.22 > 162.243.188.66.56371: Flags [P.], seq 3677361:3677745, ack 64, win 502, options [nop,nop,TS val 2999222445 ecr 1341586688], length 384
03:57:34.152337 IP 159.89.117.68.22 > 162.243.188.66.56371: Flags [P.], seq 3677745:3677969, ack 64, win 502, options [nop,nop,TS val 2999222446 ecr 1341586688], length 224
03:57:34.152550 IP 159.89.117.68.22 > 162.243.188.66.56371: Flags [P.], seq 3677969:3678193, ack 64, win 502, options [nop,nop,TS val 2999222446 ecr 1341586688], length 224
03:57:34.152745 IP 159.89.117.68.22 > 162.243.188.66.56371: Flags [P.], seq 3678193:3678417, ack 64, win 502, options [nop,nop,TS val 2999222446 ecr 1341586688], length 224
03:57:34.152953 IP 159.89.117.68.22 > 162.243.188.66.56371: Flags [P.], seq 3678417:3678641, ack 64, win 502, options [nop,nop,TS val 2999222446 ecr 1341586688], length 224
03:57:34.153107 IP 159.89.117.68.22 > 162.243.188.66.56371: Flags [P.], seq 3678641:3678865, ack 64, win 502, options [nop,nop,TS val 2999222446 ecr 1341586688], length 224
03:57:34.153243 IP 159.89.117.68.22 > 162.243.188.66.56371: Flags [P.], seq 3678865:3679089, ack 64, win 502, options [nop,nop,TS val 2999222447 ecr 1341586688], length 224
03:57:34.153431 IP 159.89.117.68.22 > 162.243.188.66.56371: Flags [P.], seq 3679089:3679313, ack 64, win 502, options [nop,nop,TS val 2999222447 ecr 1341586688], length 224
03:57:34.153604 IP 162.243.188.66.56371 > 159.89.117.68.22: Flags [.], ack 3656081, win 5467, options [nop,nop,TS val 1341586690 ecr 2999222426], length 0
03:57:34.153760 IP 159.89.117.68.22 > 162.243.188.66.56371: Flags [P.], seq 3679313:3679697, ack 64, win 502, options [nop,nop,TS val 2999222447 ecr 1341586690], length 384
03:57:34.153963 IP 159.89.117.68.22 > 162.243.188.66.56371: Flags [P.], seq 3679697:3679921, ack 64, win 502, options [nop,nop,TS val 2999222447 ecr 1341586690], length 224
03:57:34.154021 IP 162.243.188.66.56371 > 159.89.117.68.22: Flags [.], ack 3657585, win 5467, options [nop,nop,TS val 1341586691 ecr 2999222427], length 0
03:57:34.154239 IP 159.89.117.68.22 > 162.243.188.66.56371: Flags [P.], seq 3679921:3680305, ack 64, win 502, options [nop,nop,TS val 2999222448 ecr 1341586691], length 384
03:57:34.154436 IP 162.243.188.66.56371 > 159.89.117.68.22: Flags [.], ack 3659089, win 5467, options [nop,nop,TS val 1341586692 ecr 2999222428], length 0
03:57:34.154559 IP 159.89.117.68.22 > 162.243.188.66.56371: Flags [P.], seq 3680305:3680529, ack 64, win 502, options [nop,nop,TS val 2999222448 ecr 1341586692], length 224
03:57:34.154640 IP 159.89.117.68.22 > 162.243.188.66.56371: Flags [P.], seq 3680529:3680737, ack 64, win 502, options [nop,nop,TS val 2999222448 ecr 1341586692], length 208
03:57:34.154797 IP 159.89.117.68.22 > 162.243.188.66.56371: Flags [P.], seq 3680737:3681137, ack 64, win 502, options [nop,nop,TS val 2999222448 ecr 1341586692], length 400
03:57:34.154940 IP 159.89.117.68.22 > 162.243.188.66.56371: Flags [P.], seq 3681137:3681361, ack 64, win 502, options [nop,nop,TS val 2999222448 ecr 1341586692], length 224
03:57:34.155071 IP 159.89.117.68.22 > 162.243.188.66.56371: Flags [P.], seq 3681361:3681585, ack 64, win 502, options [nop,nop,TS val 2999222448 ecr 1341586692], length 224
03:57:34.155207 IP 159.89.117.68.22 > 162.243.188.66.56371: Flags [P.], seq 3681585:3681809, ack 64, win 502, options [nop,nop,TS val 2999222449 ecr 1341586692], length 224
03:57:34.155343 IP 159.89.117.68.22 > 162.243.188.66.56371: Flags [P.], seq 3681809:3682033, ack 64, win 502, options [nop,nop,TS val 2999222449 ecr 1341586692], length 224
03:57:34.155477 IP 159.89.117.68.22 > 162.243.188.66.56371: Flags [P.], seq 3682033:3682257, ack 64, win 502, options [nop,nop,TS val 2999222449 ecr 1341586692], length 224
03:57:34.155643 IP 159.89.117.68.22 > 162.243.188.66.56371: Flags [P.], seq 3682257:3682481, ack 64, win 502, options [nop,nop,TS val 2999222449 ecr 1341586692], length 224
03:57:34.155730 IP 162.243.188.66.56371 > 159.89.117.68.22: Flags [.], ack 3660657, win 5467, options [nop,nop,TS val 1341586693 ecr 2999222430], length 0
03:57:34.155857 IP 159.89.117.68.22 > 162.243.188.66.56371: Flags [P.], seq 3682481:3682865, ack 64, win 502, options [nop,nop,TS val 2999222449 ecr 1341586693], length 384
03:57:34.155997 IP 159.89.117.68.22 > 162.243.188.66.56371: Flags [P.], seq 3682865:3683089, ack 64, win 502, options [nop,nop,TS val 2999222449 ecr 1341586693], length 224
03:57:34.156131 IP 159.89.117.68.22 > 162.243.188.66.56371: Flags [P.], seq 3683089:3683313, ack 64, win 502, options [nop,nop,TS val 2999222449 ecr 1341586693], length 224
03:57:34.156274 IP 159.89.117.68.22 > 162.243.188.66.56371: Flags [P.], seq 3683313:3683537, ack 64, win 502, options [nop,nop,TS val 2999222450 ecr 1341586693], length 224
03:57:34.156410 IP 159.89.117.68.22 > 162.243.188.66.56371: Flags [P.], seq 3683537:3683761, ack 64, win 502, options [nop,nop,TS val 2999222450 ecr 1341586693], length 224
03:57:34.156550 IP 162.243.188.66.56371 > 159.89.117.68.22: Flags [.], ack 3662161, win 5467, options [nop,nop,TS val 1341586694 ecr 2999222431], length 0
03:57:34.156673 IP 159.89.117.68.22 > 162.243.188.66.56371: Flags [P.], seq 3683761:3684145, ack 64, win 502, options [nop,nop,TS val 2999222450 ecr 1341586694], length 384
03:57:34.156814 IP 159.89.117.68.22 > 162.243.188.66.56371: Flags [P.], seq 3684145:3684369, ack 64, win 502, options [nop,nop,TS val 2999222450 ecr 1341586694], length 224
03:57:34.156947 IP 159.89.117.68.22 > 162.243.188.66.56371: Flags [P.], seq 3684369:3684593, ack 64, win 502, options [nop,nop,TS val 2999222450 ecr 1341586694], length 224
03:57:34.157088 IP 159.89.117.68.22 > 162.243.188.66.56371: Flags [P.], seq 3684593:3684817, ack 64, win 502, options [nop,nop,TS val 2999222450 ecr 1341586694], length 224
03:57:34.157226 IP 159.89.117.68.22 > 162.243.188.66.56371: Flags [P.], seq 3684817:3685041, ack 64, win 502, options [nop,nop,TS val 2999222451 ecr 1341586694], length 224
03:57:34.157368 IP 159.89.117.68.22 > 162.243.188.66.56371: Flags [P.], seq 3685041:3685265, ack 64, win 502, options [nop,nop,TS val 2999222451 ecr 1341586694], length 224
03:57:34.157502 IP 159.89.117.68.22 > 162.243.188.66.56371: Flags [P.], seq 3685265:3685489, ack 64, win 502, options [nop,nop,TS val 2999222451 ecr 1341586694], length 224
03:57:34.157637 IP 159.89.117.68.22 > 162.243.188.66.56371: Flags [P.], seq 3685489:3685713, ack 64, win 502, options [nop,nop,TS val 2999222451 ecr 1341586694], length 224
03:57:34.157784 IP 159.89.117.68.22 > 162.243.188.66.56371: Flags [P.], seq 3685713:3685937, ack 64, win 502, options [nop,nop,TS val 2999222451 ecr 1341586694], length 224
03:57:34.157920 IP 159.89.117.68.22 > 162.243.188.66.56371: Flags [P.], seq 3685937:3686161, ack 64, win 502, options [nop,nop,TS val 2999222451 ecr 1341586694], length 224
03:57:34.158074 IP 159.89.117.68.22 > 162.243.188.66.56371: Flags [P.], seq 3686161:3686385, ack 64, win 502, options [nop,nop,TS val 2999222451 ecr 1341586694], length 224
03:57:34.158296 IP 159.89.117.68.22 > 162.243.188.66.56371: Flags [P.], seq 3686385:3686609, ack 64, win 502, options [nop,nop,TS val 2999222452 ecr 1341586694], length 224
03:57:34.158446 IP 162.243.188.66.56371 > 159.89.117.68.22: Flags [.], ack 3663985, win 5467, options [nop,nop,TS val 1341586695 ecr 2999222432], length 0
03:57:34.158581 IP 159.89.117.68.22 > 162.243.188.66.56371: Flags [P.], seq 3686609:3686993, ack 64, win 502, options [nop,nop,TS val 2999222452 ecr 1341586695], length 384
03:57:34.158738 IP 159.89.117.68.22 > 162.243.188.66.56371: Flags [P.], seq 3686993:3687217, ack 64, win 502, options [nop,nop,TS val 2999222452 ecr 1341586695], length 224
03:57:34.158880 IP 159.89.117.68.22 > 162.243.188.66.56371: Flags [P.], seq 3687217:3687441, ack 64, win 502, options [nop,nop,TS val 2999222452 ecr 1341586695], length 224
03:57:34.159016 IP 159.89.117.68.22 > 162.243.188.66.56371: Flags [P.], seq 3687441:3687665, ack 64, win 502, options [nop,nop,TS val 2999222452 ecr 1341586695], length 224
03:57:34.159151 IP 159.89.117.68.22 > 162.243.188.66.56371: Flags [P.], seq 3687665:3687889, ack 64, win 502, options [nop,nop,TS val 2999222452 ecr 1341586695], length 224
03:57:34.159294 IP 159.89.117.68.22 > 162.243.188.66.56371: Flags [P.], seq 3687889:3688113, ack 64, win 502, options [nop,nop,TS val 2999222453 ecr 1341586695], length 224
03:57:34.159426 IP 159.89.117.68.22 > 162.243.188.66.56371: Flags [P.], seq 3688113:3688337, ack 64, win 502, options [nop,nop,TS val 2999222453 ecr 1341586695], length 224
03:57:34.159570 IP 159.89.117.68.22 > 162.243.188.66.56371: Flags [P.], seq 3688337:3688561, ack 64, win 502, options [nop,nop,TS val 2999222453 ecr 1341586695], length 224
03:57:34.159745 IP 159.89.117.68.22 > 162.243.188.66.56371: Flags [P.], seq 3688561:3688785, ack 64, win 502, options [nop,nop,TS val 2999222453 ecr 1341586695], length 224
03:57:34.159893 IP 159.89.117.68.22 > 162.243.188.66.56371: Flags [P.], seq 3688785:3689009, ack 64, win 502, options [nop,nop,TS val 2999222453 ecr 1341586695], length 224
03:57:34.160030 IP 159.89.117.68.22 > 162.243.188.66.56371: Flags [P.], seq 3689009:3689233, ack 64, win 502, options [nop,nop,TS val 2999222453 ecr 1341586695], length 224
03:57:34.160148 IP 162.243.188.66.56371 > 159.89.117.68.22: Flags [.], ack 3665553, win 5467, options [nop,nop,TS val 1341586696 ecr 2999222434], length 0
03:57:34.160218 IP 159.89.117.68.22 > 162.243.188.66.56371: Flags [P.], seq 3689233:3689457, ack 64, win 502, options [nop,nop,TS val 2999222454 ecr 1341586696], length 224
03:57:34.160381 IP 159.89.117.68.22 > 162.243.188.66.56371: Flags [P.], seq 3689457:3689841, ack 64, win 502, options [nop,nop,TS val 2999222454 ecr 1341586696], length 384
03:57:34.160596 IP 159.89.117.68.22 > 162.243.188.66.56371: Flags [P.], seq 3689841:3690065, ack 64, win 502, options [nop,nop,TS val 2999222454 ecr 1341586696], length 224
03:57:34.160784 IP 159.89.117.68.22 > 162.243.188.66.56371: Flags [P.], seq 3690065:3690289, ack 64, win 502, options [nop,nop,TS val 2999222454 ecr 1341586696], length 224
03:57:34.160925 IP 159.89.117.68.22 > 162.243.188.66.56371: Flags [P.], seq 3690289:3690513, ack 64, win 502, options [nop,nop,TS val 2999222454 ecr 1341586696], length 224
03:57:34.161059 IP 159.89.117.68.22 > 162.243.188.66.56371: Flags [P.], seq 3690513:3690737, ack 64, win 502, options [nop,nop,TS val 2999222454 ecr 1341586696], length 224
03:57:34.161188 IP 159.89.117.68.22 > 162.243.188.66.56371: Flags [P.], seq 3690737:3690961, ack 64, win 502, options [nop,nop,TS val 2999222455 ecr 1341586696], length 224
03:57:34.161321 IP 159.89.117.68.22 > 162.243.188.66.56371: Flags [P.], seq 3690961:3691185, ack 64, win 502, options [nop,nop,TS val 2999222455 ecr 1341586696], length 224
03:57:34.161455 IP 159.89.117.68.22 > 162.243.188.66.56371: Flags [P.], seq 3691185:3691409, ack 64, win 502, options [nop,nop,TS val 2999222455 ecr 1341586696], length 224
03:57:34.161589 IP 159.89.117.68.22 > 162.243.188.66.56371: Flags [P.], seq 3691409:3691633, ack 64, win 502, options [nop,nop,TS val 2999222455 ecr 1341586696], length 224
03:57:34.161747 IP 159.89.117.68.22 > 162.243.188.66.56371: Flags [P.], seq 3691633:3691857, ack 64, win 502, options [nop,nop,TS val 2999222455 ecr 1341586696], length 224
03:57:34.161952 IP 162.243.188.66.56371 > 159.89.117.68.22: Flags [.], ack 3667217, win 5467, options [nop,nop,TS val 1341586698 ecr 2999222436], length 0
03:57:34.162042 IP 159.89.117.68.22 > 162.243.188.66.56371: Flags [P.], seq 3691857:3692081, ack 64, win 502, options [nop,nop,TS val 2999222455 ecr 1341586698], length 224
03:57:34.162228 IP 159.89.117.68.22 > 162.243.188.66.56371: Flags [P.], seq 3692081:3692465, ack 64, win 502, options [nop,nop,TS val 2999222456 ecr 1341586698], length 384
03:57:34.162365 IP 159.89.117.68.22 > 162.243.188.66.56371: Flags [P.], seq 3692465:3692689, ack 64, win 502, options [nop,nop,TS val 2999222456 ecr 1341586698], length 224
03:57:34.162503 IP 159.89.117.68.22 > 162.243.188.66.56371: Flags [P.], seq 3692689:3692913, ack 64, win 502, options [nop,nop,TS val 2999222456 ecr 1341586698], length 224
03:57:34.162639 IP 159.89.117.68.22 > 162.243.188.66.56371: Flags [P.], seq 3692913:3693137, ack 64, win 502, options [nop,nop,TS val 2999222456 ecr 1341586698], length 224
03:57:34.162772 IP 159.89.117.68.22 > 162.243.188.66.56371: Flags [P.], seq 3693137:3693361, ack 64, win 502, options [nop,nop,TS val 2999222456 ecr 1341586698], length 224
03:57:34.162911 IP 159.89.117.68.22 > 162.243.188.66.56371: Flags [P.], seq 3693361:3693585, ack 64, win 502, options [nop,nop,TS val 2999222456 ecr 1341586698], length 224
03:57:34.163051 IP 159.89.117.68.22 > 162.243.188.66.56371: Flags [P.], seq 3693585:3693809, ack 64, win 502, options [nop,nop,TS val 2999222456 ecr 1341586698], length 224
03:57:34.163185 IP 159.89.117.68.22 > 162.243.188.66.56371: Flags [P.], seq 3693809:3694033, ack 64, win 502, options [nop,nop,TS val 2999222457 ecr 1341586698], length 224
03:57:34.163321 IP 159.89.117.68.22 > 162.243.188.66.56371: Flags [P.], seq 3694033:3694257, ack 64, win 502, options [nop,nop,TS val 2999222457 ecr 1341586698], length 224
03:57:34.163466 IP 159.89.117.68.22 > 162.243.188.66.56371: Flags [P.], seq 3694257:3694481, ack 64, win 502, options [nop,nop,TS val 2999222457 ecr 1341586698], length 224
03:57:34.163633 IP 159.89.117.68.22 > 162.243.188.66.56371: Flags [P.], seq 3694481:3694705, ack 64, win 502, options [nop,nop,TS val 2999222457 ecr 1341586698], length 224
03:57:34.163773 IP 159.89.117.68.22 > 162.243.188.66.56371: Flags [P.], seq 3694705:3694929, ack 64, win 502, options [nop,nop,TS val 2999222457 ecr 1341586698], length 224
03:57:34.163908 IP 159.89.117.68.22 > 162.243.188.66.56371: Flags [P.], seq 3694929:3695153, ack 64, win 502, options [nop,nop,TS val 2999222457 ecr 1341586698], length 224
03:57:34.164024 IP 162.243.188.66.56371 > 159.89.117.68.22: Flags [.], ack 3668721, win 5467, options [nop,nop,TS val 1341586700 ecr 2999222437], length 0
03:57:34.164141 IP 159.89.117.68.22 > 162.243.188.66.56371: Flags [P.], seq 3695153:3695537, ack 64, win 502, options [nop,nop,TS val 2999222457 ecr 1341586700], length 384
03:57:34.164447 IP 159.89.117.68.22 > 162.243.188.66.56371: Flags [P.], seq 3695537:3695761, ack 64, win 502, options [nop,nop,TS val 2999222458 ecr 1341586700], length 224
03:57:34.164631 IP 159.89.117.68.22 > 162.243.188.66.56371: Flags [P.], seq 3695761:3695985, ack 64, win 502, options [nop,nop,TS val 2999222458 ecr 1341586700], length 224
03:57:34.164775 IP 159.89.117.68.22 > 162.243.188.66.56371: Flags [P.], seq 3695985:3696209, ack 64, win 502, options [nop,nop,TS val 2999222458 ecr 1341586700], length 224
03:57:34.164916 IP 159.89.117.68.22 > 162.243.188.66.56371: Flags [P.], seq 3696209:3696433, ack 64, win 502, options [nop,nop,TS val 2999222458 ecr 1341586700], length 224
03:57:34.165056 IP 159.89.117.68.22 > 162.243.188.66.56371: Flags [P.], seq 3696433:3696657, ack 64, win 502, options [nop,nop,TS val 2999222458 ecr 1341586700], length 224
03:57:34.165186 IP 159.89.117.68.22 > 162.243.188.66.56371: Flags [P.], seq 3696657:3696881, ack 64, win 502, options [nop,nop,TS val 2999222459 ecr 1341586700], length 224
03:57:34.165321 IP 159.89.117.68.22 > 162.243.188.66.56371: Flags [P.], seq 3696881:3697105, ack 64, win 502, options [nop,nop,TS val 2999222459 ecr 1341586700], length 224
03:57:34.165459 IP 159.89.117.68.22 > 162.243.188.66.56371: Flags [P.], seq 3697105:3697329, ack 64, win 502, options [nop,nop,TS val 2999222459 ecr 1341586700], length 224
03:57:34.165590 IP 159.89.117.68.22 > 162.243.188.66.56371: Flags [P.], seq 3697329:3697553, ack 64, win 502, options [nop,nop,TS val 2999222459 ecr 1341586700], length 224
03:57:34.165698 IP 162.243.188.66.56371 > 159.89.117.68.22: Flags [.], ack 3670449, win 5467, options [nop,nop,TS val 1341586701 ecr 2999222438], length 0
03:57:34.165772 IP 159.89.117.68.22 > 162.243.188.66.56371: Flags [P.], seq 3697553:3697777, ack 64, win 502, options [nop,nop,TS val 2999222459 ecr 1341586701], length 224
03:57:34.166043 IP 159.89.117.68.22 > 162.243.188.66.56371: Flags [P.], seq 3697777:3698161, ack 64, win 502, options [nop,nop,TS val 2999222459 ecr 1341586701], length 384
03:57:34.166198 IP 159.89.117.68.22 > 162.243.188.66.56371: Flags [P.], seq 3698161:3698385, ack 64, win 502, options [nop,nop,TS val 2999222460 ecr 1341586701], length 224
03:57:34.166332 IP 159.89.117.68.22 > 162.243.188.66.56371: Flags [P.], seq 3698385:3698609, ack 64, win 502, options [nop,nop,TS val 2999222460 ecr 1341586701], length 224
03:57:34.166465 IP 159.89.117.68.22 > 162.243.188.66.56371: Flags [P.], seq 3698609:3698833, ack 64, win 502, options [nop,nop,TS val 2999222460 ecr 1341586701], length 224
03:57:34.166596 IP 159.89.117.68.22 > 162.243.188.66.56371: Flags [P.], seq 3698833:3699057, ack 64, win 502, options [nop,nop,TS val 2999222460 ecr 1341586701], length 224
03:57:34.166824 IP 159.89.117.68.22 > 162.243.188.66.56371: Flags [P.], seq 3699057:3699281, ack 64, win 502, options [nop,nop,TS val 2999222460 ecr 1341586701], length 224
03:57:34.166988 IP 159.89.117.68.22 > 162.243.188.66.56371: Flags [P.], seq 3699281:3699505, ack 64, win 502, options [nop,nop,TS val 2999222460 ecr 1341586701], length 224
03:57:34.167125 IP 159.89.117.68.22 > 162.243.188.66.56371: Flags [P.], seq 3699505:3699729, ack 64, win 502, options [nop,nop,TS val 2999222460 ecr 1341586701], length 224
03:57:34.167258 IP 159.89.117.68.22 > 162.243.188.66.56371: Flags [P.], seq 3699729:3699953, ack 64, win 502, options [nop,nop,TS val 2999222461 ecr 1341586701], length 224
03:57:34.167389 IP 159.89.117.68.22 > 162.243.188.66.56371: Flags [P.], seq 3699953:3700177, ack 64, win 502, options [nop,nop,TS val 2999222461 ecr 1341586701], length 224
03:57:34.167526 IP 159.89.117.68.22 > 162.243.188.66.56371: Flags [P.], seq 3700177:3700401, ack 64, win 502, options [nop,nop,TS val 2999222461 ecr 1341586701], length 224
03:57:34.167708 IP 159.89.117.68.22 > 162.243.188.66.56371: Flags [P.], seq 3700401:3700625, ack 64, win 502, options [nop,nop,TS val 2999222461 ecr 1341586701], length 224
03:57:34.167853 IP 159.89.117.68.22 > 162.243.188.66.56371: Flags [P.], seq 3700625:3700849, ack 64, win 502, options [nop,nop,TS val 2999222461 ecr 1341586701], length 224
03:57:34.167991 IP 159.89.117.68.22 > 162.243.188.66.56371: Flags [P.], seq 3700849:3701073, ack 64, win 502, options [nop,nop,TS val 2999222461 ecr 1341586701], length 224
03:57:34.168127 IP 159.89.117.68.22 > 162.243.188.66.56371: Flags [P.], seq 3701073:3701297, ack 64, win 502, options [nop,nop,TS val 2999222461 ecr 1341586701], length 224
03:57:34.168261 IP 159.89.117.68.22 > 162.243.188.66.56371: Flags [P.], seq 3701297:3701521, ack 64, win 502, options [nop,nop,TS val 2999222462 ecr 1341586701], length 224
03:57:34.168391 IP 159.89.117.68.22 > 162.243.188.66.56371: Flags [P.], seq 3701521:3701745, ack 64, win 502, options [nop,nop,TS val 2999222462 ecr 1341586701], length 224
03:57:34.168556 IP 159.89.117.68.22 > 162.243.188.66.56371: Flags [P.], seq 3701745:3701969, ack 64, win 502, options [nop,nop,TS val 2999222462 ecr 1341586701], length 224
03:57:34.168692 IP 159.89.117.68.22 > 162.243.188.66.56371: Flags [P.], seq 3701969:3702193, ack 64, win 502, options [nop,nop,TS val 2999222462 ecr 1341586701], length 224
03:57:34.168825 IP 159.89.117.68.22 > 162.243.188.66.56371: Flags [P.], seq 3702193:3702417, ack 64, win 502, options [nop,nop,TS val 2999222462 ecr 1341586701], length 224
03:57:34.168957 IP 159.89.117.68.22 > 162.243.188.66.56371: Flags [P.], seq 3702417:3702641, ack 64, win 502, options [nop,nop,TS val 2999222462 ecr 1341586701], length 224
03:57:34.169086 IP 159.89.117.68.22 > 162.243.188.66.56371: Flags [P.], seq 3702641:3702865, ack 64, win 502, options [nop,nop,TS val 2999222462 ecr 1341586701], length 224
03:57:34.169222 IP 159.89.117.68.22 > 162.243.188.66.56371: Flags [P.], seq 3702865:3703089, ack 64, win 502, options [nop,nop,TS val 2999222463 ecr 1341586701], length 224
03:57:34.169358 IP 159.89.117.68.22 > 162.243.188.66.56371: Flags [P.], seq 3703089:3703313, ack 64, win 502, options [nop,nop,TS val 2999222463 ecr 1341586701], length 224
03:57:34.169489 IP 159.89.117.68.22 > 162.243.188.66.56371: Flags [P.], seq 3703313:3703537, ack 64, win 502, options [nop,nop,TS val 2999222463 ecr 1341586701], length 224
03:57:34.169618 IP 159.89.117.68.22 > 162.243.188.66.56371: Flags [P.], seq 3703537:3703761, ack 64, win 502, options [nop,nop,TS val 2999222463 ecr 1341586701], length 224
03:57:34.169747 IP 159.89.117.68.22 > 162.243.188.66.56371: Flags [P.], seq 3703761:3703985, ack 64, win 502, options [nop,nop,TS val 2999222463 ecr 1341586701], length 224
03:57:34.169882 IP 159.89.117.68.22 > 162.243.188.66.56371: Flags [P.], seq 3703985:3704209, ack 64, win 502, options [nop,nop,TS val 2999222463 ecr 1341586701], length 224
03:57:34.170026 IP 159.89.117.68.22 > 162.243.188.66.56371: Flags [P.], seq 3704209:3704433, ack 64, win 502, options [nop,nop,TS val 2999222463 ecr 1341586701], length 224
03:57:34.170164 IP 159.89.117.68.22 > 162.243.188.66.56371: Flags [P.], seq 3704433:3704657, ack 64, win 502, options [nop,nop,TS val 2999222464 ecr 1341586701], length 224
03:57:34.170302 IP 159.89.117.68.22 > 162.243.188.66.56371: Flags [P.], seq 3704657:3704881, ack 64, win 502, options [nop,nop,TS val 2999222464 ecr 1341586701], length 224
03:57:34.170437 IP 159.89.117.68.22 > 162.243.188.66.56371: Flags [P.], seq 3704881:3705105, ack 64, win 502, options [nop,nop,TS val 2999222464 ecr 1341586701], length 224
03:57:34.170576 IP 159.89.117.68.22 > 162.243.188.66.56371: Flags [P.], seq 3705105:3705329, ack 64, win 502, options [nop,nop,TS val 2999222464 ecr 1341586701], length 224
03:57:34.170706 IP 159.89.117.68.22 > 162.243.188.66.56371: Flags [P.], seq 3705329:3705553, ack 64, win 502, options [nop,nop,TS val 2999222464 ecr 1341586701], length 224
03:57:34.170841 IP 159.89.117.68.22 > 162.243.188.66.56371: Flags [P.], seq 3705553:3705777, ack 64, win 502, options [nop,nop,TS val 2999222464 ecr 1341586701], length 224
03:57:34.170988 IP 159.89.117.68.22 > 162.243.188.66.56371: Flags [P.], seq 3705777:3706001, ack 64, win 502, options [nop,nop,TS val 2999222464 ecr 1341586701], length 224
03:57:34.171126 IP 159.89.117.68.22 > 162.243.188.66.56371: Flags [P.], seq 3706001:3706225, ack 64, win 502, options [nop,nop,TS val 2999222464 ecr 1341586701], length 224
03:57:34.172699 IP 162.243.188.66.56371 > 159.89.117.68.22: Flags [.], ack 3671953, win 5462, options [nop,nop,TS val 1341586702 ecr 2999222439], length 0
03:57:34.172699 IP 162.243.188.66.56371 > 159.89.117.68.22: Flags [.], ack 3673521, win 5450, options [nop,nop,TS val 1341586704 ecr 2999222440], length 0
03:57:34.172699 IP 162.243.188.66.56371 > 159.89.117.68.22: Flags [.], ack 3675025, win 5439, options [nop,nop,TS val 1341586706 ecr 2999222441], length 0
03:57:34.172699 IP 162.243.188.66.56371 > 159.89.117.68.22: Flags [.], ack 3676529, win 5428, options [nop,nop,TS val 1341586706 ecr 2999222443], length 0
03:57:34.172699 IP 162.243.188.66.56371 > 159.89.117.68.22: Flags [.], ack 3678193, win 5415, options [nop,nop,TS val 1341586707 ecr 2999222445], length 0
03:57:34.172699 IP 162.243.188.66.56371 > 159.89.117.68.22: Flags [.], ack 3679697, win 5404, options [nop,nop,TS val 1341586709 ecr 2999222446], length 0
03:57:34.172757 IP 159.89.117.68.22 > 162.243.188.66.56371: Flags [P.], seq 3706225:3706449, ack 64, win 502, options [nop,nop,TS val 2999222466 ecr 1341586702], length 224
03:57:34.173101 IP 159.89.117.68.22 > 162.243.188.66.56371: Flags [P.], seq 3706449:3707617, ack 64, win 502, options [nop,nop,TS val 2999222466 ecr 1341586709], length 1168
03:57:34.173254 IP 159.89.117.68.22 > 162.243.188.66.56371: Flags [P.], seq 3707617:3707857, ack 64, win 502, options [nop,nop,TS val 2999222467 ecr 1341586709], length 240
03:57:34.173395 IP 159.89.117.68.22 > 162.243.188.66.56371: Flags [P.], seq 3707857:3708081, ack 64, win 502, options [nop,nop,TS val 2999222467 ecr 1341586709], length 224
03:57:34.173534 IP 159.89.117.68.22 > 162.243.188.66.56371: Flags [P.], seq 3708081:3708305, ack 64, win 502, options [nop,nop,TS val 2999222467 ecr 1341586709], length 224
03:57:34.173666 IP 159.89.117.68.22 > 162.243.188.66.56371: Flags [P.], seq 3708305:3708529, ack 64, win 502, options [nop,nop,TS val 2999222467 ecr 1341586709], length 224
03:57:34.173797 IP 159.89.117.68.22 > 162.243.188.66.56371: Flags [P.], seq 3708529:3708753, ack 64, win 502, options [nop,nop,TS val 2999222467 ecr 1341586709], length 224
03:57:34.174000 IP 159.89.117.68.22 > 162.243.188.66.56371: Flags [P.], seq 3708753:3708977, ack 64, win 502, options [nop,nop,TS val 2999222467 ecr 1341586709], length 224
03:57:34.174178 IP 159.89.117.68.22 > 162.243.188.66.56371: Flags [P.], seq 3708977:3709201, ack 64, win 502, options [nop,nop,TS val 2999222468 ecr 1341586709], length 224
03:57:34.174324 IP 159.89.117.68.22 > 162.243.188.66.56371: Flags [P.], seq 3709201:3709425, ack 64, win 502, options [nop,nop,TS val 2999222468 ecr 1341586709], length 224
03:57:34.174412 IP 162.243.188.66.56371 > 159.89.117.68.22: Flags [.], ack 3681361, win 5391, options [nop,nop,TS val 1341586711 ecr 2999222447], length 0
03:57:34.174546 IP 159.89.117.68.22 > 162.243.188.66.56371: Flags [P.], seq 3709425:3709809, ack 64, win 502, options [nop,nop,TS val 2999222468 ecr 1341586711], length 384
03:57:34.174692 IP 159.89.117.68.22 > 162.243.188.66.56371: Flags [P.], seq 3709809:3710033, ack 64, win 502, options [nop,nop,TS val 2999222468 ecr 1341586711], length 224
03:57:34.174853 IP 159.89.117.68.22 > 162.243.188.66.56371: Flags [P.], seq 3710033:3710257, ack 64, win 502, options [nop,nop,TS val 2999222468 ecr 1341586711], length 224
03:57:34.175000 IP 159.89.117.68.22 > 162.243.188.66.56371: Flags [P.], seq 3710257:3710481, ack 64, win 502, options [nop,nop,TS val 2999222468 ecr 1341586711], length 224
03:57:34.175129 IP 162.243.188.66.56371 > 159.89.117.68.22: Flags [.], ack 3682865, win 5380, options [nop,nop,TS val 1341586711 ecr 2999222448], length 0
03:57:34.175235 IP 159.89.117.68.22 > 162.243.188.66.56371: Flags [P.], seq 3710481:3710705, ack 64, win 502, options [nop,nop,TS val 2999222469 ecr 1341586711], length 224
03:57:34.175367 IP 159.89.117.68.22 > 162.243.188.66.56371: Flags [P.], seq 3710705:3710913, ack 64, win 502, options [nop,nop,TS val 2999222469 ecr 1341586711], length 208
03:57:34.175436 IP 159.89.117.68.22 > 162.243.188.66.56371: Flags [P.], seq 3710913:3711137, ack 64, win 502, options [nop,nop,TS val 2999222469 ecr 1341586711], length 224
03:57:34.175670 IP 159.89.117.68.22 > 162.243.188.66.56371: Flags [P.], seq 3711137:3711537, ack 64, win 502, options [nop,nop,TS val 2999222469 ecr 1341586711], length 400
03:57:34.175896 IP 159.89.117.68.22 > 162.243.188.66.56371: Flags [P.], seq 3711537:3711761, ack 64, win 502, options [nop,nop,TS val 2999222469 ecr 1341586711], length 224
03:57:34.176074 IP 159.89.117.68.22 > 162.243.188.66.56371: Flags [P.], seq 3711761:3711985, ack 64, win 502, options [nop,nop,TS val 2999222469 ecr 1341586711], length 224
03:57:34.176215 IP 159.89.117.68.22 > 162.243.188.66.56371: Flags [P.], seq 3711985:3712209, ack 64, win 502, options [nop,nop,TS val 2999222470 ecr 1341586711], length 224
03:57:34.176345 IP 159.89.117.68.22 > 162.243.188.66.56371: Flags [P.], seq 3712209:3712433, ack 64, win 502, options [nop,nop,TS val 2999222470 ecr 1341586711], length 224
03:57:34.176478 IP 159.89.117.68.22 > 162.243.188.66.56371: Flags [P.], seq 3712433:3712657, ack 64, win 502, options [nop,nop,TS val 2999222470 ecr 1341586711], length 224
03:57:34.176635 IP 159.89.117.68.22 > 162.243.188.66.56371: Flags [P.], seq 3712657:3712881, ack 64, win 502, options [nop,nop,TS val 2999222470 ecr 1341586711], length 224
03:57:34.176776 IP 159.89.117.68.22 > 162.243.188.66.56371: Flags [P.], seq 3712881:3713105, ack 64, win 502, options [nop,nop,TS val 2999222470 ecr 1341586711], length 224
03:57:34.176905 IP 162.243.188.66.56371 > 159.89.117.68.22: Flags [.], ack 3684369, win 5369, options [nop,nop,TS val 1341586712 ecr 2999222449], length 0
03:57:34.176989 IP 159.89.117.68.22 > 162.243.188.66.56371: Flags [P.], seq 3713105:3713329, ack 64, win 502, options [nop,nop,TS val 2999222470 ecr 1341586712], length 224
03:57:34.177157 IP 159.89.117.68.22 > 162.243.188.66.56371: Flags [P.], seq 3713329:3713713, ack 64, win 502, options [nop,nop,TS val 2999222471 ecr 1341586712], length 384
03:57:34.177288 IP 159.89.117.68.22 > 162.243.188.66.56371: Flags [P.], seq 3713713:3713937, ack 64, win 502, options [nop,nop,TS val 2999222471 ecr 1341586712], length 224
03:57:34.177416 IP 159.89.117.68.22 > 162.243.188.66.56371: Flags [P.], seq 3713937:3714161, ack 64, win 502, options [nop,nop,TS val 2999222471 ecr 1341586712], length 224
03:57:34.177479 IP 162.243.188.66.56371 > 159.89.117.68.22: Flags [.], ack 3685937, win 5357, options [nop,nop,TS val 1341586713 ecr 2999222450], length 0
03:57:34.177615 IP 159.89.117.68.22 > 162.243.188.66.56371: Flags [P.], seq 3714161:3714545, ack 64, win 502, options [nop,nop,TS val 2999222471 ecr 1341586713], length 384
03:57:34.177759 IP 159.89.117.68.22 > 162.243.188.66.56371: Flags [P.], seq 3714545:3714769, ack 64, win 502, options [nop,nop,TS val 2999222471 ecr 1341586713], length 224
03:57:34.177891 IP 159.89.117.68.22 > 162.243.188.66.56371: Flags [P.], seq 3714769:3714993, ack 64, win 502, options [nop,nop,TS val 2999222471 ecr 1341586713], length 224
03:57:34.178022 IP 159.89.117.68.22 > 162.243.188.66.56371: Flags [P.], seq 3714993:3715217, ack 64, win 502, options [nop,nop,TS val 2999222471 ecr 1341586713], length 224
03:57:34.178150 IP 159.89.117.68.22 > 162.243.188.66.56371: Flags [P.], seq 3715217:3715441, ack 64, win 502, options [nop,nop,TS val 2999222471 ecr 1341586713], length 224
03:57:34.178283 IP 159.89.117.68.22 > 162.243.188.66.56371: Flags [P.], seq 3715441:3715665, ack 64, win 502, options [nop,nop,TS val 2999222472 ecr 1341586713], length 224
03:57:34.178365 IP 162.243.188.66.56371 > 159.89.117.68.22: Flags [.], ack 3687441, win 5346, options [nop,nop,TS val 1341586714 ecr 2999222451], length 0
03:57:34.178481 IP 159.89.117.68.22 > 162.243.188.66.56371: Flags [P.], seq 3715665:3716049, ack 64, win 502, options [nop,nop,TS val 2999222472 ecr 1341586714], length 384
03:57:34.178636 IP 159.89.117.68.22 > 162.243.188.66.56371: Flags [P.], seq 3716049:3716273, ack 64, win 502, options [nop,nop,TS val 2999222472 ecr 1341586714], length 224
03:57:34.178835 IP 159.89.117.68.22 > 162.243.188.66.56371: Flags [P.], seq 3716273:3716497, ack 64, win 502, options [nop,nop,TS val 2999222472 ecr 1341586714], length 224
03:57:34.179014 IP 159.89.117.68.22 > 162.243.188.66.56371: Flags [P.], seq 3716497:3716721, ack 64, win 502, options [nop,nop,TS val 2999222472 ecr 1341586714], length 224
03:57:34.179154 IP 159.89.117.68.22 > 162.243.188.66.56371: Flags [P.], seq 3716721:3716945, ack 64, win 502, options [nop,nop,TS val 2999222473 ecr 1341586714], length 224
03:57:34.179295 IP 159.89.117.68.22 > 162.243.188.66.56371: Flags [P.], seq 3716945:3717169, ack 64, win 502, options [nop,nop,TS val 2999222473 ecr 1341586714], length 224
03:57:34.179428 IP 159.89.117.68.22 > 162.243.188.66.56371: Flags [P.], seq 3717169:3717393, ack 64, win 502, options [nop,nop,TS val 2999222473 ecr 1341586714], length 224
03:57:34.179560 IP 159.89.117.68.22 > 162.243.188.66.56371: Flags [P.], seq 3717393:3717617, ack 64, win 502, options [nop,nop,TS val 2999222473 ecr 1341586714], length 224
03:57:34.179726 IP 159.89.117.68.22 > 162.243.188.66.56371: Flags [P.], seq 3717617:3717841, ack 64, win 502, options [nop,nop,TS val 2999222473 ecr 1341586714], length 224
03:57:34.179946 IP 159.89.117.68.22 > 162.243.188.66.56371: Flags [P.], seq 3717841:3718065, ack 64, win 502, options [nop,nop,TS val 2999222473 ecr 1341586714], length 224
03:57:34.179992 IP 162.243.188.66.56371 > 159.89.117.68.22: Flags [.], ack 3689009, win 5334, options [nop,nop,TS val 1341586716 ecr 2999222452], length 0
03:57:34.180157 IP 159.89.117.68.22 > 162.243.188.66.56371: Flags [P.], seq 3718065:3718449, ack 64, win 502, options [nop,nop,TS val 2999222474 ecr 1341586716], length 384
03:57:34.180301 IP 159.89.117.68.22 > 162.243.188.66.56371: Flags [P.], seq 3718449:3718673, ack 64, win 502, options [nop,nop,TS val 2999222474 ecr 1341586716], length 224
03:57:34.180442 IP 159.89.117.68.22 > 162.243.188.66.56371: Flags [P.], seq 3718673:3718897, ack 64, win 502, options [nop,nop,TS val 2999222474 ecr 1341586716], length 224
03:57:34.180602 IP 159.89.117.68.22 > 162.243.188.66.56371: Flags [P.], seq 3718897:3719121, ack 64, win 502, options [nop,nop,TS val 2999222474 ecr 1341586716], length 224
03:57:34.180651 IP 162.243.188.66.56371 > 159.89.117.68.22: Flags [.], ack 3690513, win 5323, options [nop,nop,TS val 1341586717 ecr 2999222453], length 0
03:57:34.180815 IP 159.89.117.68.22 > 162.243.188.66.56371: Flags [P.], seq 3719121:3719505, ack 64, win 502, options [nop,nop,TS val 2999222474 ecr 1341586717], length 384
03:57:34.181036 IP 159.89.117.68.22 > 162.243.188.66.56371: Flags [P.], seq 3719505:3719729, ack 64, win 502, options [nop,nop,TS val 2999222474 ecr 1341586717], length 224
03:57:34.181176 IP 159.89.117.68.22 > 162.243.188.66.56371: Flags [P.], seq 3719729:3719953, ack 64, win 502, options [nop,nop,TS val 2999222475 ecr 1341586717], length 224
03:57:34.181316 IP 159.89.117.68.22 > 162.243.188.66.56371: Flags [P.], seq 3719953:3720177, ack 64, win 502, options [nop,nop,TS val 2999222475 ecr 1341586717], length 224
03:57:34.181447 IP 159.89.117.68.22 > 162.243.188.66.56371: Flags [P.], seq 3720177:3720401, ack 64, win 502, options [nop,nop,TS val 2999222475 ecr 1341586717], length 224
03:57:34.181574 IP 159.89.117.68.22 > 162.243.188.66.56371: Flags [P.], seq 3720401:3720625, ack 64, win 502, options [nop,nop,TS val 2999222475 ecr 1341586717], length 224
03:57:34.181716 IP 162.243.188.66.56371 > 159.89.117.68.22: Flags [.], ack 3692081, win 5311, options [nop,nop,TS val 1341586718 ecr 2999222454], length 0
03:57:34.181734 IP 159.89.117.68.22 > 162.243.188.66.56371: Flags [P.], seq 3720625:3720849, ack 64, win 502, options [nop,nop,TS val 2999222475 ecr 1341586717], length 224
03:57:34.181911 IP 159.89.117.68.22 > 162.243.188.66.56371: Flags [P.], seq 3720849:3721233, ack 64, win 502, options [nop,nop,TS val 2999222475 ecr 1341586718], length 384
03:57:34.182024 IP 162.243.188.66.56371 > 159.89.117.68.22: Flags [.], ack 3693585, win 5300, options [nop,nop,TS val 1341586719 ecr 2999222456], length 0
03:57:34.182096 IP 159.89.117.68.22 > 162.243.188.66.56371: Flags [P.], seq 3721233:3721457, ack 64, win 502, options [nop,nop,TS val 2999222475 ecr 1341586719], length 224
03:57:34.182259 IP 159.89.117.68.22 > 162.243.188.66.56371: Flags [P.], seq 3721457:3721841, ack 64, win 502, options [nop,nop,TS val 2999222476 ecr 1341586719], length 384
03:57:34.182391 IP 159.89.117.68.22 > 162.243.188.66.56371: Flags [P.], seq 3721841:3722065, ack 64, win 502, options [nop,nop,TS val 2999222476 ecr 1341586719], length 224
03:57:34.182520 IP 159.89.117.68.22 > 162.243.188.66.56371: Flags [P.], seq 3722065:3722289, ack 64, win 502, options [nop,nop,TS val 2999222476 ecr 1341586719], length 224
03:57:34.182651 IP 159.89.117.68.22 > 162.243.188.66.56371: Flags [P.], seq 3722289:3722513, ack 64, win 502, options [nop,nop,TS val 2999222476 ecr 1341586719], length 224
03:57:34.182789 IP 159.89.117.68.22 > 162.243.188.66.56371: Flags [P.], seq 3722513:3722737, ack 64, win 502, options [nop,nop,TS val 2999222476 ecr 1341586719], length 224
03:57:34.182871 IP 162.243.188.66.56371 > 159.89.117.68.22: Flags [.], ack 3695153, win 5288, options [nop,nop,TS val 1341586720 ecr 2999222456], length 0
03:57:34.183006 IP 159.89.117.68.22 > 162.243.188.66.56371: Flags [P.], seq 3722737:3723121, ack 64, win 502, options [nop,nop,TS val 2999222476 ecr 1341586720], length 384
03:57:34.183144 IP 159.89.117.68.22 > 162.243.188.66.56371: Flags [P.], seq 3723121:3723345, ack 64, win 502, options [nop,nop,TS val 2999222476 ecr 1341586720], length 224
03:57:34.183277 IP 159.89.117.68.22 > 162.243.188.66.56371: Flags [P.], seq 3723345:3723569, ack 64, win 502, options [nop,nop,TS val 2999222477 ecr 1341586720], length 224
03:57:34.183410 IP 159.89.117.68.22 > 162.243.188.66.56371: Flags [P.], seq 3723569:3723793, ack 64, win 502, options [nop,nop,TS val 2999222477 ecr 1341586720], length 224
03:57:34.183535 IP 159.89.117.68.22 > 162.243.188.66.56371: Flags [P.], seq 3723793:3724017, ack 64, win 502, options [nop,nop,TS val 2999222477 ecr 1341586720], length 224
03:57:34.183716 IP 159.89.117.68.22 > 162.243.188.66.56371: Flags [P.], seq 3724017:3724241, ack 64, win 502, options [nop,nop,TS val 2999222477 ecr 1341586720], length 224
03:57:34.183859 IP 159.89.117.68.22 > 162.243.188.66.56371: Flags [P.], seq 3724241:3724465, ack 64, win 502, options [nop,nop,TS val 2999222477 ecr 1341586720], length 224
03:57:34.183990 IP 159.89.117.68.22 > 162.243.188.66.56371: Flags [P.], seq 3724465:3724689, ack 64, win 502, options [nop,nop,TS val 2999222477 ecr 1341586720], length 224
03:57:34.184096 IP 162.243.188.66.56371 > 159.89.117.68.22: Flags [.], ack 3696657, win 5277, options [nop,nop,TS val 1341586721 ecr 2999222457], length 0
03:57:34.184300 IP 159.89.117.68.22 > 162.243.188.66.56371: Flags [P.], seq 3724689:3725073, ack 64, win 502, options [nop,nop,TS val 2999222478 ecr 1341586721], length 384
03:57:34.184481 IP 159.89.117.68.22 > 162.243.188.66.56371: Flags [P.], seq 3725073:3725297, ack 64, win 502, options [nop,nop,TS val 2999222478 ecr 1341586721], length 224
03:57:34.184644 IP 159.89.117.68.22 > 162.243.188.66.56371: Flags [P.], seq 3725297:3725521, ack 64, win 502, options [nop,nop,TS val 2999222478 ecr 1341586721], length 224
03:57:34.184822 IP 159.89.117.68.22 > 162.243.188.66.56371: Flags [P.], seq 3725521:3725745, ack 64, win 502, options [nop,nop,TS val 2999222478 ecr 1341586721], length 224
03:57:34.185004 IP 159.89.117.68.22 > 162.243.188.66.56371: Flags [P.], seq 3725745:3725969, ack 64, win 502, options [nop,nop,TS val 2999222478 ecr 1341586721], length 224
03:57:34.185145 IP 159.89.117.68.22 > 162.243.188.66.56371: Flags [P.], seq 3725969:3726193, ack 64, win 502, options [nop,nop,TS val 2999222478 ecr 1341586721], length 224
03:57:34.185278 IP 159.89.117.68.22 > 162.243.188.66.56371: Flags [P.], seq 3726193:3726417, ack 64, win 502, options [nop,nop,TS val 2999222479 ecr 1341586721], length 224
03:57:34.185408 IP 159.89.117.68.22 > 162.243.188.66.56371: Flags [P.], seq 3726417:3726641, ack 64, win 502, options [nop,nop,TS val 2999222479 ecr 1341586721], length 224
03:57:34.185486 IP 162.243.188.66.56371 > 159.89.117.68.22: Flags [.], ack 3698161, win 5266, options [nop,nop,TS val 1341586721 ecr 2999222459], length 0
03:57:34.185660 IP 159.89.117.68.22 > 162.243.188.66.56371: Flags [P.], seq 3726641:3727025, ack 64, win 502, options [nop,nop,TS val 2999222479 ecr 1341586721], length 384
03:57:34.185806 IP 159.89.117.68.22 > 162.243.188.66.56371: Flags [P.], seq 3727025:3727249, ack 64, win 502, options [nop,nop,TS val 2999222479 ecr 1341586721], length 224
03:57:34.185951 IP 159.89.117.68.22 > 162.243.188.66.56371: Flags [P.], seq 3727249:3727473, ack 64, win 502, options [nop,nop,TS val 2999222479 ecr 1341586721], length 224
03:57:34.186082 IP 159.89.117.68.22 > 162.243.188.66.56371: Flags [P.], seq 3727473:3727697, ack 64, win 502, options [nop,nop,TS val 2999222479 ecr 1341586721], length 224
03:57:34.186241 IP 162.243.188.66.56371 > 159.89.117.68.22: Flags [.], ack 3699729, win 5254, options [nop,nop,TS val 1341586722 ecr 2999222460], length 0
03:57:34.186274 IP 159.89.117.68.22 > 162.243.188.66.56371: Flags [P.], seq 3727697:3727921, ack 64, win 502, options [nop,nop,TS val 2999222480 ecr 1341586722], length 224
03:57:34.186441 IP 159.89.117.68.22 > 162.243.188.66.56371: Flags [P.], seq 3727921:3728305, ack 64, win 502, options [nop,nop,TS val 2999222480 ecr 1341586722], length 384
03:57:34.186583 IP 159.89.117.68.22 > 162.243.188.66.56371: Flags [P.], seq 3728305:3728529, ack 64, win 502, options [nop,nop,TS val 2999222480 ecr 1341586722], length 224
03:57:34.186713 IP 159.89.117.68.22 > 162.243.188.66.56371: Flags [P.], seq 3728529:3728753, ack 64, win 502, options [nop,nop,TS val 2999222480 ecr 1341586722], length 224
03:57:34.186909 IP 159.89.117.68.22 > 162.243.188.66.56371: Flags [P.], seq 3728753:3728977, ack 64, win 502, options [nop,nop,TS val 2999222480 ecr 1341586722], length 224
03:57:34.187074 IP 159.89.117.68.22 > 162.243.188.66.56371: Flags [P.], seq 3728977:3729201, ack 64, win 502, options [nop,nop,TS val 2999222480 ecr 1341586722], length 224
03:57:34.187216 IP 159.89.117.68.22 > 162.243.188.66.56371: Flags [P.], seq 3729201:3729425, ack 64, win 502, options [nop,nop,TS val 2999222481 ecr 1341586722], length 224
03:57:34.187353 IP 159.89.117.68.22 > 162.243.188.66.56371: Flags [P.], seq 3729425:3729649, ack 64, win 502, options [nop,nop,TS val 2999222481 ecr 1341586722], length 224
03:57:34.187482 IP 159.89.117.68.22 > 162.243.188.66.56371: Flags [P.], seq 3729649:3729873, ack 64, win 502, options [nop,nop,TS val 2999222481 ecr 1341586722], length 224
03:57:34.187646 IP 159.89.117.68.22 > 162.243.188.66.56371: Flags [P.], seq 3729873:3730097, ack 64, win 502, options [nop,nop,TS val 2999222481 ecr 1341586722], length 224
03:57:34.187854 IP 159.89.117.68.22 > 162.243.188.66.56371: Flags [P.], seq 3730097:3730321, ack 64, win 502, options [nop,nop,TS val 2999222481 ecr 1341586722], length 224
03:57:34.188033 IP 159.89.117.68.22 > 162.243.188.66.56371: Flags [P.], seq 3730321:3730545, ack 64, win 502, options [nop,nop,TS val 2999222481 ecr 1341586722], length 224
