, ack 448, win 502, options [nop,nop,TS val 3946699974 ecr 3428701178], length 256
04:01:00.044093 IP lamp-ubuntu-s-1vcpu-1gb-tor1-01.ssh > 198.211.111.194.46317: Flags [P.], seq 11145857:11146113, ack 448, win 502, options [nop,nop,TS val 3946699974 ecr 3428701178], length 256
04:01:00.044378 IP lamp-ubuntu-s-1vcpu-1gb-tor1-01.ssh > 198.211.111.194.46317: Flags [P.], seq 11146113:11146369, ack 448, win 502, options [nop,nop,TS val 3946699975 ecr 3428701178], length 256
04:01:00.044619 IP 198.211.111.194.46317 > lamp-ubuntu-s-1vcpu-1gb-tor1-01.ssh: Flags [.], ack 11130609, win 501, options [nop,nop,TS val 3428701179 ecr 3946699962], length 0
04:01:00.044754 IP lamp-ubuntu-s-1vcpu-1gb-tor1-01.ssh > 198.211.111.194.46317: Flags [P.], seq 11146369:11146625, ack 448, win 502, options [nop,nop,TS val 3946699975 ecr 3428701179], length 256
04:01:00.044960 IP lamp-ubuntu-s-1vcpu-1gb-tor1-01.ssh > 198.211.111.194.46317: Flags [P.], seq 11146625:11147057, ack 448, win 502, options [nop,nop,TS val 3946699975 ecr 3428701179], length 432
04:01:00.045114 IP lamp-ubuntu-s-1vcpu-1gb-tor1-01.ssh > 198.211.111.194.46317: Flags [P.], seq 11147057:11147313, ack 448, win 502, options [nop,nop,TS val 3946699975 ecr 3428701179], length 256
04:01:00.045261 IP lamp-ubuntu-s-1vcpu-1gb-tor1-01.ssh > 198.211.111.194.46317: Flags [P.], seq 11147313:11147569, ack 448, win 502, options [nop,nop,TS val 3946699976 ecr 3428701179], length 256
04:01:00.045400 IP lamp-ubuntu-s-1vcpu-1gb-tor1-01.ssh > 198.211.111.194.46317: Flags [P.], seq 11147569:11147825, ack 448, win 502, options [nop,nop,TS val 3946699976 ecr 3428701179], length 256
04:01:00.045539 IP lamp-ubuntu-s-1vcpu-1gb-tor1-01.ssh > 198.211.111.194.46317: Flags [P.], seq 11147825:11148081, ack 448, win 502, options [nop,nop,TS val 3946699976 ecr 3428701179], length 256
04:01:00.045602 IP 198.211.111.194.46317 > lamp-ubuntu-s-1vcpu-1gb-tor1-01.ssh: Flags [.], ack 11132065, win 501, options [nop,nop,TS val 3428701180 ecr 3946699963], length 0
04:01:00.045750 IP lamp-ubuntu-s-1vcpu-1gb-tor1-01.ssh > 198.211.111.194.46317: Flags [P.], seq 11148081:11148513, ack 448, win 502, options [nop,nop,TS val 3946699976 ecr 3428701180], length 432
04:01:00.045911 IP lamp-ubuntu-s-1vcpu-1gb-tor1-01.ssh > 198.211.111.194.46317: Flags [P.], seq 11148513:11148769, ack 448, win 502, options [nop,nop,TS val 3946699976 ecr 3428701180], length 256
04:01:00.046105 IP lamp-ubuntu-s-1vcpu-1gb-tor1-01.ssh > 198.211.111.194.46317: Flags [P.], seq 11148769:11149025, ack 448, win 502, options [nop,nop,TS val 3946699976 ecr 3428701180], length 256
04:01:00.046346 IP lamp-ubuntu-s-1vcpu-1gb-tor1-01.ssh > 198.211.111.194.46317: Flags [P.], seq 11149025:11149281, ack 448, win 502, options [nop,nop,TS val 3946699977 ecr 3428701180], length 256
04:01:00.046500 IP lamp-ubuntu-s-1vcpu-1gb-tor1-01.ssh > 198.211.111.194.46317: Flags [P.], seq 11149281:11149537, ack 448, win 502, options [nop,nop,TS val 3946699977 ecr 3428701180], length 256
04:01:00.046638 IP lamp-ubuntu-s-1vcpu-1gb-tor1-01.ssh > 198.211.111.194.46317: Flags [P.], seq 11149537:11149793, ack 448, win 502, options [nop,nop,TS val 3946699977 ecr 3428701180], length 256
04:01:00.046779 IP lamp-ubuntu-s-1vcpu-1gb-tor1-01.ssh > 198.211.111.194.46317: Flags [P.], seq 11149793:11150049, ack 448, win 502, options [nop,nop,TS val 3946699977 ecr 3428701180], length 256
04:01:00.046875 IP 198.211.111.194.46317 > lamp-ubuntu-s-1vcpu-1gb-tor1-01.ssh: Flags [.], ack 11133521, win 501, options [nop,nop,TS val 3428701181 ecr 3946699964], length 0
04:01:00.047000 IP lamp-ubuntu-s-1vcpu-1gb-tor1-01.ssh > 198.211.111.194.46317: Flags [P.], seq 11150049:11150481, ack 448, win 502, options [nop,nop,TS val 3946699977 ecr 3428701181], length 432
04:01:00.047165 IP lamp-ubuntu-s-1vcpu-1gb-tor1-01.ssh > 198.211.111.194.46317: Flags [P.], seq 11150481:11150737, ack 448, win 502, options [nop,nop,TS val 3946699978 ecr 3428701181], length 256
04:01:00.047322 IP lamp-ubuntu-s-1vcpu-1gb-tor1-01.ssh > 198.211.111.194.46317: Flags [P.], seq 11150737:11150993, ack 448, win 502, options [nop,nop,TS val 3946699978 ecr 3428701181], length 256
04:01:00.047470 IP lamp-ubuntu-s-1vcpu-1gb-tor1-01.ssh > 198.211.111.194.46317: Flags [P.], seq 11150993:11151249, ack 448, win 502, options [nop,nop,TS val 3946699978 ecr 3428701181], length 256
04:01:00.047615 IP lamp-ubuntu-s-1vcpu-1gb-tor1-01.ssh > 198.211.111.194.46317: Flags [P.], seq 11151249:11151505, ack 448, win 502, options [nop,nop,TS val 3946699978 ecr 3428701181], length 256
04:01:00.047794 IP lamp-ubuntu-s-1vcpu-1gb-tor1-01.ssh > 198.211.111.194.46317: Flags [P.], seq 11151505:11151761, ack 448, win 502, options [nop,nop,TS val 3946699978 ecr 3428701181], length 256
04:01:00.048200 IP 198.211.111.194.46317 > lamp-ubuntu-s-1vcpu-1gb-tor1-01.ssh: Flags [.], ack 11134977, win 501, options [nop,nop,TS val 3428701182 ecr 3946699965], length 0
04:01:00.048248 IP lamp-ubuntu-s-1vcpu-1gb-tor1-01.ssh > 198.211.111.194.46317: Flags [P.], seq 11151761:11152017, ack 448, win 502, options [nop,nop,TS val 3946699979 ecr 3428701182], length 256
04:01:00.048598 IP lamp-ubuntu-s-1vcpu-1gb-tor1-01.ssh > 198.211.111.194.46317: Flags [P.], seq 11152017:11152449, ack 448, win 502, options [nop,nop,TS val 3946699979 ecr 3428701182], length 432
04:01:00.048758 IP lamp-ubuntu-s-1vcpu-1gb-tor1-01.ssh > 198.211.111.194.46317: Flags [P.], seq 11152449:11152705, ack 448, win 502, options [nop,nop,TS val 3946699979 ecr 3428701182], length 256
04:01:00.048982 IP 198.211.111.194.46317 > lamp-ubuntu-s-1vcpu-1gb-tor1-01.ssh: Flags [.], ack 11136433, win 501, options [nop,nop,TS val 3428701183 ecr 3946699966], length 0
04:01:00.049032 IP lamp-ubuntu-s-1vcpu-1gb-tor1-01.ssh > 198.211.111.194.46317: Flags [P.], seq 11152705:11152961, ack 448, win 502, options [nop,nop,TS val 3946699979 ecr 3428701183], length 256
04:01:00.049263 IP lamp-ubuntu-s-1vcpu-1gb-tor1-01.ssh > 198.211.111.194.46317: Flags [P.], seq 11152961:11153393, ack 448, win 502, options [nop,nop,TS val 3946699980 ecr 3428701183], length 432
04:01:00.049432 IP lamp-ubuntu-s-1vcpu-1gb-tor1-01.ssh > 198.211.111.194.46317: Flags [P.], seq 11153393:11153649, ack 448, win 502, options [nop,nop,TS val 3946699980 ecr 3428701183], length 256
04:01:00.049658 IP lamp-ubuntu-s-1vcpu-1gb-tor1-01.ssh > 198.211.111.194.46317: Flags [P.], seq 11153649:11153905, ack 448, win 502, options [nop,nop,TS val 3946699980 ecr 3428701183], length 256
04:01:00.049882 IP lamp-ubuntu-s-1vcpu-1gb-tor1-01.ssh > 198.211.111.194.46317: Flags [P.], seq 11153905:11154161, ack 448, win 502, options [nop,nop,TS val 3946699980 ecr 3428701183], length 256
04:01:00.050038 IP 198.211.111.194.46317 > lamp-ubuntu-s-1vcpu-1gb-tor1-01.ssh: Flags [.], ack 11137889, win 501, options [nop,nop,TS val 3428701184 ecr 3946699967], length 0
04:01:00.050107 IP lamp-ubuntu-s-1vcpu-1gb-tor1-01.ssh > 198.211.111.194.46317: Flags [P.], seq 11154161:11154417, ack 448, win 502, options [nop,nop,TS val 3946699980 ecr 3428701184], length 256
04:01:00.050374 IP lamp-ubuntu-s-1vcpu-1gb-tor1-01.ssh > 198.211.111.194.46317: Flags [P.], seq 11154417:11154849, ack 448, win 502, options [nop,nop,TS val 3946699981 ecr 3428701184], length 432
04:01:00.050525 IP lamp-ubuntu-s-1vcpu-1gb-tor1-01.ssh > 198.211.111.194.46317: Flags [P.], seq 11154849:11155105, ack 448, win 502, options [nop,nop,TS val 3946699981 ecr 3428701184], length 256
04:01:00.050667 IP lamp-ubuntu-s-1vcpu-1gb-tor1-01.ssh > 198.211.111.194.46317: Flags [P.], seq 11155105:11155361, ack 448, win 502, options [nop,nop,TS val 3946699981 ecr 3428701184], length 256
04:01:00.050902 IP lamp-ubuntu-s-1vcpu-1gb-tor1-01.ssh > 198.211.111.194.46317: Flags [P.], seq 11155361:11155617, ack 448, win 502, options [nop,nop,TS val 3946699981 ecr 3428701184], length 256
04:01:00.051195 IP 198.211.111.194.46317 > lamp-ubuntu-s-1vcpu-1gb-tor1-01.ssh: Flags [.], ack 11139345, win 501, options [nop,nop,TS val 3428701185 ecr 3946699968], length 0
04:01:00.051347 IP lamp-ubuntu-s-1vcpu-1gb-tor1-01.ssh > 198.211.111.194.46317: Flags [P.], seq 11155617:11155873, ack 448, win 502, options [nop,nop,TS val 3946699982 ecr 3428701185], length 256
04:01:00.051449 IP lamp-ubuntu-s-1vcpu-1gb-tor1-01.ssh > 198.211.111.194.46317: Flags [P.], seq 11155873:11156113, ack 448, win 502, options [nop,nop,TS val 3946699982 ecr 3428701185], length 240
04:01:00.051678 IP lamp-ubuntu-s-1vcpu-1gb-tor1-01.ssh > 198.211.111.194.46317: Flags [P.], seq 11156113:11156561, ack 448, win 502, options [nop,nop,TS val 3946699982 ecr 3428701185], length 448
04:01:00.051973 IP lamp-ubuntu-s-1vcpu-1gb-tor1-01.ssh > 198.211.111.194.46317: Flags [P.], seq 11156561:11156817, ack 448, win 502, options [nop,nop,TS val 3946699982 ecr 3428701185], length 256
04:01:00.052216 IP lamp-ubuntu-s-1vcpu-1gb-tor1-01.ssh > 198.211.111.194.46317: Flags [P.], seq 11156817:11157073, ack 448, win 502, options [nop,nop,TS val 3946699983 ecr 3428701185], length 256
04:01:00.052273 IP 198.211.111.194.46317 > lamp-ubuntu-s-1vcpu-1gb-tor1-01.ssh: Flags [.], ack 11140801, win 501, options [nop,nop,TS val 3428701187 ecr 3946699969], length 0
04:01:00.052492 IP lamp-ubuntu-s-1vcpu-1gb-tor1-01.ssh > 198.211.111.194.46317: Flags [P.], seq 11157073:11157505, ack 448, win 502, options [nop,nop,TS val 3946699983 ecr 3428701187], length 432
04:01:00.052701 IP lamp-ubuntu-s-1vcpu-1gb-tor1-01.ssh > 198.211.111.194.46317: Flags [P.], seq 11157505:11157761, ack 448, win 502, options [nop,nop,TS val 3946699983 ecr 3428701187], length 256
04:01:00.052891 IP lamp-ubuntu-s-1vcpu-1gb-tor1-01.ssh > 198.211.111.194.46317: Flags [P.], seq 11157761:11158017, ack 448, win 502, options [nop,nop,TS val 3946699983 ecr 3428701187], length 256
04:01:00.053258 IP lamp-ubuntu-s-1vcpu-1gb-tor1-01.ssh > 198.211.111.194.46317: Flags [P.], seq 11158017:11158273, ack 448, win 502, options [nop,nop,TS val 3946699984 ecr 3428701187], length 256
04:01:00.053463 IP lamp-ubuntu-s-1vcpu-1gb-tor1-01.ssh > 198.211.111.194.46317: Flags [P.], seq 11158273:11158529, ack 448, win 502, options [nop,nop,TS val 3946699984 ecr 3428701187], length 256
04:01:00.053642 IP lamp-ubuntu-s-1vcpu-1gb-tor1-01.ssh > 198.211.111.194.46317: Flags [P.], seq 11158529:11158785, ack 448, win 502, options [nop,nop,TS val 3946699984 ecr 3428701187], length 256
04:01:00.053799 IP lamp-ubuntu-s-1vcpu-1gb-tor1-01.ssh > 198.211.111.194.46317: Flags [P.], seq 11158785:11159041, ack 448, win 502, options [nop,nop,TS val 3946699984 ecr 3428701187], length 256
04:01:00.053951 IP 198.211.111.194.46317 > lamp-ubuntu-s-1vcpu-1gb-tor1-01.ssh: Flags [.], ack 11142433, win 501, options [nop,nop,TS val 3428701188 ecr 3946699971], length 0
04:01:00.054045 IP lamp-ubuntu-s-1vcpu-1gb-tor1-01.ssh > 198.211.111.194.46317: Flags [P.], seq 11159041:11159297, ack 448, win 502, options [nop,nop,TS val 3946699984 ecr 3428701188], length 256
04:01:00.054131 IP lamp-ubuntu-s-1vcpu-1gb-tor1-01.ssh > 198.211.111.194.46317: Flags [P.], seq 11159297:11159537, ack 448, win 502, options [nop,nop,TS val 3946699984 ecr 3428701188], length 240
04:01:00.054371 IP lamp-ubuntu-s-1vcpu-1gb-tor1-01.ssh > 198.211.111.194.46317: Flags [P.], seq 11159537:11159985, ack 448, win 502, options [nop,nop,TS val 3946699985 ecr 3428701188], length 448
04:01:00.054538 IP lamp-ubuntu-s-1vcpu-1gb-tor1-01.ssh > 198.211.111.194.46317: Flags [P.], seq 11159985:11160241, ack 448, win 502, options [nop,nop,TS val 3946699985 ecr 3428701188], length 256
04:01:00.054680 IP lamp-ubuntu-s-1vcpu-1gb-tor1-01.ssh > 198.211.111.194.46317: Flags [P.], seq 11160241:11160497, ack 448, win 502, options [nop,nop,TS val 3946699985 ecr 3428701188], length 256
04:01:00.054823 IP lamp-ubuntu-s-1vcpu-1gb-tor1-01.ssh > 198.211.111.194.46317: Flags [P.], seq 11160497:11160753, ack 448, win 502, options [nop,nop,TS val 3946699985 ecr 3428701188], length 256
04:01:00.055080 IP lamp-ubuntu-s-1vcpu-1gb-tor1-01.ssh > 198.211.111.194.46317: Flags [P.], seq 11160753:11161009, ack 448, win 502, options [nop,nop,TS val 3946699985 ecr 3428701188], length 256
04:01:00.055256 IP lamp-ubuntu-s-1vcpu-1gb-tor1-01.ssh > 198.211.111.194.46317: Flags [P.], seq 11161009:11161265, ack 448, win 502, options [nop,nop,TS val 3946699986 ecr 3428701188], length 256
04:01:00.055484 IP lamp-ubuntu-s-1vcpu-1gb-tor1-01.ssh > 198.211.111.194.46317: Flags [P.], seq 11161265:11161521, ack 448, win 502, options [nop,nop,TS val 3946699986 ecr 3428701188], length 256
04:01:00.055658 IP lamp-ubuntu-s-1vcpu-1gb-tor1-01.ssh > 198.211.111.194.46317: Flags [P.], seq 11161521:11161777, ack 448, win 502, options [nop,nop,TS val 3946699986 ecr 3428701188], length 256
04:01:00.055834 IP 198.211.111.194.46317 > lamp-ubuntu-s-1vcpu-1gb-tor1-01.ssh: Flags [.], ack 11144145, win 501, options [nop,nop,TS val 3428701189 ecr 3946699972], length 0
04:01:00.055935 IP lamp-ubuntu-s-1vcpu-1gb-tor1-01.ssh > 198.211.111.194.46317: Flags [P.], seq 11161777:11162033, ack 448, win 502, options [nop,nop,TS val 3946699986 ecr 3428701189], length 256
04:01:00.056029 IP lamp-ubuntu-s-1vcpu-1gb-tor1-01.ssh > 198.211.111.194.46317: Flags [P.], seq 11162033:11162273, ack 448, win 502, options [nop,nop,TS val 3946699986 ecr 3428701189], length 240
04:01:00.056201 IP lamp-ubuntu-s-1vcpu-1gb-tor1-01.ssh > 198.211.111.194.46317: Flags [P.], seq 11162273:11162721, ack 448, win 502, options [nop,nop,TS val 3946699987 ecr 3428701189], length 448
04:01:00.056343 IP lamp-ubuntu-s-1vcpu-1gb-tor1-01.ssh > 198.211.111.194.46317: Flags [P.], seq 11162721:11162977, ack 448, win 502, options [nop,nop,TS val 3946699987 ecr 3428701189], length 256
04:01:00.056474 IP 198.211.111.194.46317 > lamp-ubuntu-s-1vcpu-1gb-tor1-01.ssh: Flags [.], ack 11145601, win 501, options [nop,nop,TS val 3428701190 ecr 3946699973], length 0
04:01:00.056699 IP lamp-ubuntu-s-1vcpu-1gb-tor1-01.ssh > 198.211.111.194.46317: Flags [P.], seq 11162977:11163233, ack 448, win 502, options [nop,nop,TS val 3946699987 ecr 3428701190], length 256
04:01:00.056901 IP lamp-ubuntu-s-1vcpu-1gb-tor1-01.ssh > 198.211.111.194.46317: Flags [P.], seq 11163233:11163473, ack 448, win 502, options [nop,nop,TS val 3946699987 ecr 3428701190], length 240
04:01:00.057114 IP lamp-ubuntu-s-1vcpu-1gb-tor1-01.ssh > 198.211.111.194.46317: Flags [P.], seq 11163473:11163729, ack 448, win 502, options [nop,nop,TS val 3946699987 ecr 3428701190], length 256
04:01:00.057200 IP lamp-ubuntu-s-1vcpu-1gb-tor1-01.ssh > 198.211.111.194.46317: Flags [P.], seq 11163729:11163985, ack 448, win 502, options [nop,nop,TS val 3946699988 ecr 3428701190], length 256
04:01:00.057390 IP lamp-ubuntu-s-1vcpu-1gb-tor1-01.ssh > 198.211.111.194.46317: Flags [P.], seq 11163985:11164433, ack 448, win 502, options [nop,nop,TS val 3946699988 ecr 3428701190], length 448
04:01:00.057614 IP lamp-ubuntu-s-1vcpu-1gb-tor1-01.ssh > 198.211.111.194.46317: Flags [P.], seq 11164433:11164689, ack 448, win 502, options [nop,nop,TS val 3946699988 ecr 3428701190], length 256
04:01:00.057781 IP 198.211.111.194.46317 > lamp-ubuntu-s-1vcpu-1gb-tor1-01.ssh: Flags [.], ack 11147057, win 501, options [nop,nop,TS val 3428701192 ecr 3946699974], length 0
04:01:00.057809 IP lamp-ubuntu-s-1vcpu-1gb-tor1-01.ssh > 198.211.111.194.46317: Flags [P.], seq 11164689:11164945, ack 448, win 502, options [nop,nop,TS val 3946699988 ecr 3428701190], length 256
04:01:00.058089 IP lamp-ubuntu-s-1vcpu-1gb-tor1-01.ssh > 198.211.111.194.46317: Flags [P.], seq 11164945:11165377, ack 448, win 502, options [nop,nop,TS val 3946699988 ecr 3428701192], length 432
04:01:00.058255 IP lamp-ubuntu-s-1vcpu-1gb-tor1-01.ssh > 198.211.111.194.46317: Flags [P.], seq 11165377:11165633, ack 448, win 502, options [nop,nop,TS val 3946699989 ecr 3428701192], length 256
04:01:00.058402 IP lamp-ubuntu-s-1vcpu-1gb-tor1-01.ssh > 198.211.111.194.46317: Flags [P.], seq 11165633:11165889, ack 448, win 502, options [nop,nop,TS val 3946699989 ecr 3428701192], length 256
04:01:00.058536 IP 198.211.111.194.46317 > lamp-ubuntu-s-1vcpu-1gb-tor1-01.ssh: Flags [.], ack 11148513, win 501, options [nop,nop,TS val 3428701192 ecr 3946699975], length 0
04:01:00.058591 IP lamp-ubuntu-s-1vcpu-1gb-tor1-01.ssh > 198.211.111.194.46317: Flags [P.], seq 11165889:11166145, ack 448, win 502, options [nop,nop,TS val 3946699989 ecr 3428701192], length 256
04:01:00.058756 IP lamp-ubuntu-s-1vcpu-1gb-tor1-01.ssh > 198.211.111.194.46317: Flags [P.], seq 11166145:11166577, ack 448, win 502, options [nop,nop,TS val 3946699989 ecr 3428701192], length 432
04:01:00.059176 IP lamp-ubuntu-s-1vcpu-1gb-tor1-01.ssh > 198.211.111.194.46317: Flags [P.], seq 11166577:11166833, ack 448, win 502, options [nop,nop,TS val 3946699990 ecr 3428701192], length 256
04:01:00.059439 IP lamp-ubuntu-s-1vcpu-1gb-tor1-01.ssh > 198.211.111.194.46317: Flags [P.], seq 11166833:11167089, ack 448, win 502, options [nop,nop,TS val 3946699990 ecr 3428701192], length 256
04:01:00.059540 IP 198.211.111.194.46317 > lamp-ubuntu-s-1vcpu-1gb-tor1-01.ssh: Flags [.], ack 11150049, win 501, options [nop,nop,TS val 3428701193 ecr 3946699976], length 0
04:01:00.059671 IP lamp-ubuntu-s-1vcpu-1gb-tor1-01.ssh > 198.211.111.194.46317: Flags [P.], seq 11167089:11167521, ack 448, win 502, options [nop,nop,TS val 3946699990 ecr 3428701193], length 432
04:01:00.059881 IP lamp-ubuntu-s-1vcpu-1gb-tor1-01.ssh > 198.211.111.194.46317: Flags [P.], seq 11167521:11167777, ack 448, win 502, options [nop,nop,TS val 3946699990 ecr 3428701193], length 256
04:01:00.060066 IP 198.211.111.194.46317 > lamp-ubuntu-s-1vcpu-1gb-tor1-01.ssh: Flags [.], ack 11151505, win 501, options [nop,nop,TS val 3428701194 ecr 3946699977], length 0
04:01:00.060156 IP lamp-ubuntu-s-1vcpu-1gb-tor1-01.ssh > 198.211.111.194.46317: Flags [P.], seq 11167777:11168033, ack 448, win 502, options [nop,nop,TS val 3946699991 ecr 3428701194], length 256
04:01:00.060430 IP lamp-ubuntu-s-1vcpu-1gb-tor1-01.ssh > 198.211.111.194.46317: Flags [P.], seq 11168033:11168465, ack 448, win 502, options [nop,nop,TS val 3946699991 ecr 3428701194], length 432
04:01:00.060634 IP lamp-ubuntu-s-1vcpu-1gb-tor1-01.ssh > 198.211.111.194.46317: Flags [P.], seq 11168465:11168721, ack 448, win 502, options [nop,nop,TS val 3946699991 ecr 3428701194], length 256
04:01:00.060793 IP lamp-ubuntu-s-1vcpu-1gb-tor1-01.ssh > 198.211.111.194.46317: Flags [P.], seq 11168721:11168977, ack 448, win 502, options [nop,nop,TS val 3946699991 ecr 3428701194], length 256
04:01:00.060942 IP lamp-ubuntu-s-1vcpu-1gb-tor1-01.ssh > 198.211.111.194.46317: Flags [P.], seq 11168977:11169233, ack 448, win 502, options [nop,nop,TS val 3946699991 ecr 3428701194], length 256
04:01:00.061090 IP lamp-ubuntu-s-1vcpu-1gb-tor1-01.ssh > 198.211.111.194.46317: Flags [P.], seq 11169233:11169489, ack 448, win 502, options [nop,nop,TS val 3946699991 ecr 3428701194], length 256
04:01:00.061242 IP lamp-ubuntu-s-1vcpu-1gb-tor1-01.ssh > 198.211.111.194.46317: Flags [P.], seq 11169489:11169745, ack 448, win 502, options [nop,nop,TS val 3946699992 ecr 3428701194], length 256
04:01:00.061411 IP lamp-ubuntu-s-1vcpu-1gb-tor1-01.ssh > 198.211.111.194.46317: Flags [P.], seq 11169745:11170001, ack 448, win 502, options [nop,nop,TS val 3946699992 ecr 3428701194], length 256
04:01:00.061583 IP 198.211.111.194.46317 > lamp-ubuntu-s-1vcpu-1gb-tor1-01.ssh: Flags [.], ack 11152961, win 501, options [nop,nop,TS val 3428701196 ecr 3946699978], length 0
04:01:00.061725 IP lamp-ubuntu-s-1vcpu-1gb-tor1-01.ssh > 198.211.111.194.46317: Flags [P.], seq 11170001:11170433, ack 448, win 502, options [nop,nop,TS val 3946699992 ecr 3428701196], length 432
04:01:00.061887 IP lamp-ubuntu-s-1vcpu-1gb-tor1-01.ssh > 198.211.111.194.46317: Flags [P.], seq 11170433:11170689, ack 448, win 502, options [nop,nop,TS val 3946699992 ecr 3428701196], length 256
04:01:00.062039 IP lamp-ubuntu-s-1vcpu-1gb-tor1-01.ssh > 198.211.111.194.46317: Flags [P.], seq 11170689:11170945, ack 448, win 502, options [nop,nop,TS val 3946699992 ecr 3428701196], length 256
04:01:00.062184 IP lamp-ubuntu-s-1vcpu-1gb-tor1-01.ssh > 198.211.111.194.46317: Flags [P.], seq 11170945:11171201, ack 448, win 502, options [nop,nop,TS val 3946699993 ecr 3428701196], length 256
04:01:00.062327 IP lamp-ubuntu-s-1vcpu-1gb-tor1-01.ssh > 198.211.111.194.46317: Flags [P.], seq 11171201:11171457, ack 448, win 502, options [nop,nop,TS val 3946699993 ecr 3428701196], length 256
04:01:00.062466 IP lamp-ubuntu-s-1vcpu-1gb-tor1-01.ssh > 198.211.111.194.46317: Flags [P.], seq 11171457:11171713, ack 448, win 502, options [nop,nop,TS val 3946699993 ecr 3428701196], length 256
04:01:00.062642 IP lamp-ubuntu-s-1vcpu-1gb-tor1-01.ssh > 198.211.111.194.46317: Flags [P.], seq 11171713:11171969, ack 448, win 502, options [nop,nop,TS val 3946699993 ecr 3428701196], length 256
04:01:00.062838 IP lamp-ubuntu-s-1vcpu-1gb-tor1-01.ssh > 198.211.111.194.46317: Flags [P.], seq 11171969:11172225, ack 448, win 502, options [nop,nop,TS val 3946699993 ecr 3428701196], length 256
04:01:00.062990 IP lamp-ubuntu-s-1vcpu-1gb-tor1-01.ssh > 198.211.111.194.46317: Flags [P.], seq 11172225:11172481, ack 448, win 502, options [nop,nop,TS val 3946699993 ecr 3428701196], length 256
04:01:00.063059 IP 198.211.111.194.46317 > lamp-ubuntu-s-1vcpu-1gb-tor1-01.ssh: Flags [.], ack 11154417, win 501, options [nop,nop,TS val 3428701197 ecr 3946699980], length 0
04:01:00.063216 IP lamp-ubuntu-s-1vcpu-1gb-tor1-01.ssh > 198.211.111.194.46317: Flags [P.], seq 11172481:11172913, ack 448, win 502, options [nop,nop,TS val 3946699994 ecr 3428701197], length 432
04:01:00.063363 IP lamp-ubuntu-s-1vcpu-1gb-tor1-01.ssh > 198.211.111.194.46317: Flags [P.], seq 11172913:11173169, ack 448, win 502, options [nop,nop,TS val 3946699994 ecr 3428701197], length 256
04:01:00.063513 IP lamp-ubuntu-s-1vcpu-1gb-tor1-01.ssh > 198.211.111.194.46317: Flags [P.], seq 11173169:11173425, ack 448, win 502, options [nop,nop,TS val 3946699994 ecr 3428701197], length 256
04:01:00.063655 IP lamp-ubuntu-s-1vcpu-1gb-tor1-01.ssh > 198.211.111.194.46317: Flags [P.], seq 11173425:11173681, ack 448, win 502, options [nop,nop,TS val 3946699994 ecr 3428701197], length 256
04:01:00.063882 IP lamp-ubuntu-s-1vcpu-1gb-tor1-01.ssh > 198.211.111.194.46317: Flags [P.], seq 11173681:11173937, ack 448, win 502, options [nop,nop,TS val 3946699994 ecr 3428701197], length 256
04:01:00.064134 IP lamp-ubuntu-s-1vcpu-1gb-tor1-01.ssh > 198.211.111.194.46317: Flags [P.], seq 11173937:11174193, ack 448, win 502, options [nop,nop,TS val 3946699994 ecr 3428701197], length 256
04:01:00.064366 IP lamp-ubuntu-s-1vcpu-1gb-tor1-01.ssh > 198.211.111.194.46317: Flags [P.], seq 11174193:11174449, ack 448, win 502, options [nop,nop,TS val 3946699995 ecr 3428701197], length 256
04:01:00.064612 IP lamp-ubuntu-s-1vcpu-1gb-tor1-01.ssh > 198.211.111.194.46317: Flags [P.], seq 11174449:11174705, ack 448, win 502, options [nop,nop,TS val 3946699995 ecr 3428701197], length 256
04:01:00.064775 IP lamp-ubuntu-s-1vcpu-1gb-tor1-01.ssh > 198.211.111.194.46317: Flags [P.], seq 11174705:11174961, ack 448, win 502, options [nop,nop,TS val 3946699995 ecr 3428701197], length 256
04:01:00.064926 IP 198.211.111.194.46317 > lamp-ubuntu-s-1vcpu-1gb-tor1-01.ssh: Flags [.], ack 11155873, win 501, options [nop,nop,TS val 3428701198 ecr 3946699981], length 0
04:01:00.065027 IP lamp-ubuntu-s-1vcpu-1gb-tor1-01.ssh > 198.211.111.194.46317: Flags [P.], seq 11174961:11175217, ack 448, win 502, options [nop,nop,TS val 3946699995 ecr 3428701198], length 256
04:01:00.065120 IP lamp-ubuntu-s-1vcpu-1gb-tor1-01.ssh > 198.211.111.194.46317: Flags [P.], seq 11175217:11175457, ack 448, win 502, options [nop,nop,TS val 3946699995 ecr 3428701198], length 240
04:01:00.065307 IP lamp-ubuntu-s-1vcpu-1gb-tor1-01.ssh > 198.211.111.194.46317: Flags [P.], seq 11175457:11175905, ack 448, win 502, options [nop,nop,TS val 3946699996 ecr 3428701198], length 448
04:01:00.065518 IP lamp-ubuntu-s-1vcpu-1gb-tor1-01.ssh > 198.211.111.194.46317: Flags [P.], seq 11175905:11176161, ack 448, win 502, options [nop,nop,TS val 3946699996 ecr 3428701198], length 256
04:01:00.065677 IP lamp-ubuntu-s-1vcpu-1gb-tor1-01.ssh > 198.211.111.194.46317: Flags [P.], seq 11176161:11176417, ack 448, win 502, options [nop,nop,TS val 3946699996 ecr 3428701198], length 256
04:01:00.065817 IP lamp-ubuntu-s-1vcpu-1gb-tor1-01.ssh > 198.211.111.194.46317: Flags [P.], seq 11176417:11176673, ack 448, win 502, options [nop,nop,TS val 3946699996 ecr 3428701198], length 256
04:01:00.065958 IP lamp-ubuntu-s-1vcpu-1gb-tor1-01.ssh > 198.211.111.194.46317: Flags [P.], seq 11176673:11176929, ack 448, win 502, options [nop,nop,TS val 3946699996 ecr 3428701198], length 256
04:01:00.066107 IP lamp-ubuntu-s-1vcpu-1gb-tor1-01.ssh > 198.211.111.194.46317: Flags [P.], seq 11176929:11177185, ack 448, win 502, options [nop,nop,TS val 3946699996 ecr 3428701198], length 256
04:01:00.066266 IP 198.211.111.194.46317 > lamp-ubuntu-s-1vcpu-1gb-tor1-01.ssh: Flags [.], ack 11157505, win 501, options [nop,nop,TS val 3428701199 ecr 3946699982], length 0
04:01:00.066290 IP lamp-ubuntu-s-1vcpu-1gb-tor1-01.ssh > 198.211.111.194.46317: Flags [P.], seq 11177185:11177441, ack 448, win 502, options [nop,nop,TS val 3946699997 ecr 3428701198], length 256
04:01:00.066477 IP lamp-ubuntu-s-1vcpu-1gb-tor1-01.ssh > 198.211.111.194.46317: Flags [P.], seq 11177441:11177873, ack 448, win 502, options [nop,nop,TS val 3946699997 ecr 3428701199], length 432
04:01:00.066685 IP lamp-ubuntu-s-1vcpu-1gb-tor1-01.ssh > 198.211.111.194.46317: Flags [P.], seq 11177873:11178129, ack 448, win 502, options [nop,nop,TS val 3946699997 ecr 3428701199], length 256
04:01:00.066841 IP lamp-ubuntu-s-1vcpu-1gb-tor1-01.ssh > 198.211.111.194.46317: Flags [P.], seq 11178129:11178385, ack 448, win 502, options [nop,nop,TS val 3946699997 ecr 3428701199], length 256
04:01:00.066984 IP lamp-ubuntu-s-1vcpu-1gb-tor1-01.ssh > 198.211.111.194.46317: Flags [P.], seq 11178385:11178641, ack 448, win 502, options [nop,nop,TS val 3946699997 ecr 3428701199], length 256
04:01:00.067143 IP lamp-ubuntu-s-1vcpu-1gb-tor1-01.ssh > 198.211.111.194.46317: Flags [P.], seq 11178641:11178897, ack 448, win 502, options [nop,nop,TS val 3946699997 ecr 3428701199], length 256
04:01:00.067287 IP lamp-ubuntu-s-1vcpu-1gb-tor1-01.ssh > 198.211.111.194.46317: Flags [P.], seq 11178897:11179153, ack 448, win 502, options [nop,nop,TS val 3946699998 ecr 3428701199], length 256
04:01:00.067430 IP lamp-ubuntu-s-1vcpu-1gb-tor1-01.ssh > 198.211.111.194.46317: Flags [P.], seq 11179153:11179409, ack 448, win 502, options [nop,nop,TS val 3946699998 ecr 3428701199], length 256
04:01:00.067566 IP lamp-ubuntu-s-1vcpu-1gb-tor1-01.ssh > 198.211.111.194.46317: Flags [P.], seq 11179409:11179665, ack 448, win 502, options [nop,nop,TS val 3946699998 ecr 3428701199], length 256
04:01:00.067727 IP 198.211.111.194.46317 > lamp-ubuntu-s-1vcpu-1gb-tor1-01.ssh: Flags [.], ack 11159041, win 501, options [nop,nop,TS val 3428701200 ecr 3946699983], length 0
04:01:00.067840 IP lamp-ubuntu-s-1vcpu-1gb-tor1-01.ssh > 198.211.111.194.46317: Flags [P.], seq 11179665:11179921, ack 448, win 502, options [nop,nop,TS val 3946699998 ecr 3428701200], length 256
04:01:00.068024 IP lamp-ubuntu-s-1vcpu-1gb-tor1-01.ssh > 198.211.111.194.46317: Flags [P.], seq 11179921:11180353, ack 448, win 502, options [nop,nop,TS val 3946699998 ecr 3428701200], length 432
04:01:00.068168 IP lamp-ubuntu-s-1vcpu-1gb-tor1-01.ssh > 198.211.111.194.46317: Flags [P.], seq 11180353:11180609, ack 448, win 502, options [nop,nop,TS val 3946699999 ecr 3428701200], length 256
04:01:00.068310 IP lamp-ubuntu-s-1vcpu-1gb-tor1-01.ssh > 198.211.111.194.46317: Flags [P.], seq 11180609:11180865, ack 448, win 502, options [nop,nop,TS val 3946699999 ecr 3428701200], length 256
04:01:00.068447 IP lamp-ubuntu-s-1vcpu-1gb-tor1-01.ssh > 198.211.111.194.46317: Flags [P.], seq 11180865:11181121, ack 448, win 502, options [nop,nop,TS val 3946699999 ecr 3428701200], length 256
04:01:00.068615 IP lamp-ubuntu-s-1vcpu-1gb-tor1-01.ssh > 198.211.111.194.46317: Flags [P.], seq 11181121:11181377, ack 448, win 502, options [nop,nop,TS val 3946699999 ecr 3428701200], length 256
04:01:00.068779 IP lamp-ubuntu-s-1vcpu-1gb-tor1-01.ssh > 198.211.111.194.46317: Flags [P.], seq 11181377:11181633, ack 448, win 502, options [nop,nop,TS val 3946699999 ecr 3428701200], length 256
04:01:00.068980 IP lamp-ubuntu-s-1vcpu-1gb-tor1-01.ssh > 198.211.111.194.46317: Flags [P.], seq 11181633:11181889, ack 448, win 502, options [nop,nop,TS val 3946699999 ecr 3428701200], length 256
04:01:00.069133 IP lamp-ubuntu-s-1vcpu-1gb-tor1-01.ssh > 198.211.111.194.46317: Flags [P.], seq 11181889:11182145, ack 448, win 502, options [nop,nop,TS val 3946699999 ecr 3428701200], length 256
04:01:00.069276 IP lamp-ubuntu-s-1vcpu-1gb-tor1-01.ssh > 198.211.111.194.46317: Flags [P.], seq 11182145:11182401, ack 448, win 502, options [nop,nop,TS val 3946700000 ecr 3428701200], length 256
04:01:00.069418 IP lamp-ubuntu-s-1vcpu-1gb-tor1-01.ssh > 198.211.111.194.46317: Flags [P.], seq 11182401:11182657, ack 448, win 502, options [nop,nop,TS val 3946700000 ecr 3428701200], length 256
04:01:00.069562 IP lamp-ubuntu-s-1vcpu-1gb-tor1-01.ssh > 198.211.111.194.46317: Flags [P.], seq 11182657:11182913, ack 448, win 502, options [nop,nop,TS val 3946700000 ecr 3428701200], length 256
04:01:00.069705 IP lamp-ubuntu-s-1vcpu-1gb-tor1-01.ssh > 198.211.111.194.46317: Flags [P.], seq 11182913:11183169, ack 448, win 502, options [nop,nop,TS val 3946700000 ecr 3428701200], length 256
04:01:00.069853 IP lamp-ubuntu-s-1vcpu-1gb-tor1-01.ssh > 198.211.111.194.46317: Flags [P.], seq 11183169:11183425, ack 448, win 502, options [nop,nop,TS val 3946700000 ecr 3428701200], length 256
04:01:00.069923 IP 198.211.111.194.46317 > lamp-ubuntu-s-1vcpu-1gb-tor1-01.ssh: Flags [.], ack 11160497, win 501, options [nop,nop,TS val 3428701202 ecr 3946699984], length 0
04:01:00.070148 IP lamp-ubuntu-s-1vcpu-1gb-tor1-01.ssh > 198.211.111.194.46317: Flags [P.], seq 11183425:11183857, ack 448, win 502, options [nop,nop,TS val 3946700000 ecr 3428701202], length 432
04:01:00.070312 IP lamp-ubuntu-s-1vcpu-1gb-tor1-01.ssh > 198.211.111.194.46317: Flags [P.], seq 11183857:11184113, ack 448, win 502, options [nop,nop,TS val 3946700001 ecr 3428701202], length 256
04:01:00.070464 IP lamp-ubuntu-s-1vcpu-1gb-tor1-01.ssh > 198.211.111.194.46317: Flags [P.], seq 11184113:11184369, ack 448, win 502, options [nop,nop,TS val 3946700001 ecr 3428701202], length 256
04:01:00.070623 IP lamp-ubuntu-s-1vcpu-1gb-tor1-01.ssh > 198.211.111.194.46317: Flags [P.], seq 11184369:11184625, ack 448, win 502, options [nop,nop,TS val 3946700001 ecr 3428701202], length 256
04:01:00.070760 IP lamp-ubuntu-s-1vcpu-1gb-tor1-01.ssh > 198.211.111.194.46317: Flags [P.], seq 11184625:11184881, ack 448, win 502, options [nop,nop,TS val 3946700001 ecr 3428701202], length 256
04:01:00.070897 IP lamp-ubuntu-s-1vcpu-1gb-tor1-01.ssh > 198.211.111.194.46317: Flags [P.], seq 11184881:11185137, ack 448, win 502, options [nop,nop,TS val 3946700001 ecr 3428701202], length 256
04:01:00.071029 IP 198.211.111.194.46317 > lamp-ubuntu-s-1vcpu-1gb-tor1-01.ssh: Flags [.], ack 11162033, win 501, options [nop,nop,TS val 3428701203 ecr 3946699985], length 0
04:01:00.071205 IP lamp-ubuntu-s-1vcpu-1gb-tor1-01.ssh > 198.211.111.194.46317: Flags [P.], seq 11185137:11185569, ack 448, win 502, options [nop,nop,TS val 3946700002 ecr 3428701203], length 432
04:01:00.071373 IP lamp-ubuntu-s-1vcpu-1gb-tor1-01.ssh > 198.211.111.194.46317: Flags [P.], seq 11185569:11185825, ack 448, win 502, options [nop,nop,TS val 3946700002 ecr 3428701203], length 256
04:01:00.071514 IP lamp-ubuntu-s-1vcpu-1gb-tor1-01.ssh > 198.211.111.194.46317: Flags [P.], seq 11185825:11186081, ack 448, win 502, options [nop,nop,TS val 3946700002 ecr 3428701203], length 256
04:01:00.071661 IP lamp-ubuntu-s-1vcpu-1gb-tor1-01.ssh > 198.211.111.194.46317: Flags [P.], seq 11186081:11186337, ack 448, win 502, options [nop,nop,TS val 3946700002 ecr 3428701203], length 256
04:01:00.071823 IP lamp-ubuntu-s-1vcpu-1gb-tor1-01.ssh > 198.211.111.194.46317: Flags [P.], seq 11186337:11186593, ack 448, win 502, options [nop,nop,TS val 3946700002 ecr 3428701203], length 256
04:01:00.072008 IP lamp-ubuntu-s-1vcpu-1gb-tor1-01.ssh > 198.211.111.194.46317: Flags [P.], seq 11186593:11186849, ack 448, win 502, options [nop,nop,TS val 3946700002 ecr 3428701203], length 256
04:01:00.072196 IP lamp-ubuntu-s-1vcpu-1gb-tor1-01.ssh > 198.211.111.194.46317: Flags [P.], seq 11186849:11187105, ack 448, win 502, options [nop,nop,TS val 3946700003 ecr 3428701203], length 256
04:01:00.072428 IP lamp-ubuntu-s-1vcpu-1gb-tor1-01.ssh > 198.211.111.194.46317: Flags [P.], seq 11187105:11187361, ack 448, win 502, options [nop,nop,TS val 3946700003 ecr 3428701203], length 256
04:01:00.072478 IP 198.211.111.194.46317 > lamp-ubuntu-s-1vcpu-1gb-tor1-01.ssh: Flags [.], ack 11163729, win 501, options [nop,nop,TS val 3428701204 ecr 3946699986], length 0
04:01:00.072697 IP lamp-ubuntu-s-1vcpu-1gb-tor1-01.ssh > 198.211.111.194.46317: Flags [P.], seq 11187361:11187793, ack 448, win 502, options [nop,nop,TS val 3946700003 ecr 3428701204], length 432
04:01:00.072845 IP lamp-ubuntu-s-1vcpu-1gb-tor1-01.ssh > 198.211.111.194.46317: Flags [P.], seq 11187793:11188049, ack 448, win 502, options [nop,nop,TS val 3946700003 ecr 3428701204], length 256
04:01:00.072986 IP lamp-ubuntu-s-1vcpu-1gb-tor1-01.ssh > 198.211.111.194.46317: Flags [P.], seq 11188049:11188305, ack 448, win 502, options [nop,nop,TS val 3946700003 ecr 3428701204], length 256
04:01:00.073127 IP lamp-ubuntu-s-1vcpu-1gb-tor1-01.ssh > 198.211.111.194.46317: Flags [P.], seq 11188305:11188561, ack 448, win 502, options [nop,nop,TS val 3946700003 ecr 3428701204], length 256
04:01:00.073268 IP lamp-ubuntu-s-1vcpu-1gb-tor1-01.ssh > 198.211.111.194.46317: Flags [P.], seq 11188561:11188817, ack 448, win 502, options [nop,nop,TS val 3946700004 ecr 3428701204], length 256
04:01:00.073303 IP 198.211.111.194.46317 > lamp-ubuntu-s-1vcpu-1gb-tor1-01.ssh: Flags [.], ack 11165377, win 501, options [nop,nop,TS val 3428701205 ecr 3946699988], length 0
04:01:00.073523 IP lamp-ubuntu-s-1vcpu-1gb-tor1-01.ssh > 198.211.111.194.46317: Flags [P.], seq 11188817:11189249, ack 448, win 502, options [nop,nop,TS val 3946700004 ecr 3428701205], length 432
04:01:00.073702 IP lamp-ubuntu-s-1vcpu-1gb-tor1-01.ssh > 198.211.111.194.46317: Flags [P.], seq 11189249:11189505, ack 448, win 502, options [nop,nop,TS val 3946700004 ecr 3428701205], length 256
04:01:00.073857 IP lamp-ubuntu-s-1vcpu-1gb-tor1-01.ssh > 198.211.111.194.46317: Flags [P.], seq 11189505:11189761, ack 448, win 502, options [nop,nop,TS val 3946700004 ecr 3428701205], length 256
04:01:00.073965 IP 198.211.111.194.46317 > lamp-ubuntu-s-1vcpu-1gb-tor1-01.ssh: Flags [.], ack 11166833, win 501, options [nop,nop,TS val 3428701206 ecr 3946699989], length 0
04:01:00.074092 IP lamp-ubuntu-s-1vcpu-1gb-tor1-01.ssh > 198.211.111.194.46317: Flags [P.], seq 11189761:11190193, ack 448, win 502, options [nop,nop,TS val 3946700004 ecr 3428701206], length 432
04:01:00.074239 IP lamp-ubuntu-s-1vcpu-1gb-tor1-01.ssh > 198.211.111.194.46317: Flags [P.], seq 11190193:11190449, ack 448, win 502, options [nop,nop,TS val 3946700005 ecr 3428701206], length 256
04:01:00.074380 IP lamp-ubuntu-s-1vcpu-1gb-tor1-01.ssh > 198.211.111.194.46317: Flags [P.], seq 11190449:11190705, ack 448, win 502, options [nop,nop,TS val 3946700005 ecr 3428701206], length 256
04:01:00.074536 IP lamp-ubuntu-s-1vcpu-1gb-tor1-01.ssh > 198.211.111.194.46317: Flags [P.], seq 11190705:11190961, ack 448, win 502, options [nop,nop,TS val 3946700005 ecr 3428701206], length 256
04:01:00.074748 IP lamp-ubuntu-s-1vcpu-1gb-tor1-01.ssh > 198.211.111.194.46317: Flags [P.], seq 11190961:11191217, ack 448, win 502, options [nop,nop,TS val 3946700005 ecr 3428701206], length 256
04:01:00.074900 IP lamp-ubuntu-s-1vcpu-1gb-tor1-01.ssh > 198.211.111.194.46317: Flags [P.], seq 11191217:11191473, ack 448, win 502, options [nop,nop,TS val 3946700005 ecr 3428701206], length 256
04:01:00.075059 IP 198.211.111.194.46317 > lamp-ubuntu-s-1vcpu-1gb-tor1-01.ssh: Flags [.], ack 11168465, win 501, options [nop,nop,TS val 3428701207 ecr 3946699990], length 0
04:01:00.075135 IP lamp-ubuntu-s-1vcpu-1gb-tor1-01.ssh > 198.211.111.194.46317: Flags [P.], seq 11191473:11191729, ack 448, win 502, options [nop,nop,TS val 3946700005 ecr 3428701206], length 256
04:01:00.075239 IP lamp-ubuntu-s-1vcpu-1gb-tor1-01.ssh > 198.211.111.194.46317: Flags [P.], seq 11191729:11191969, ack 448, win 502, options [nop,nop,TS val 3946700006 ecr 3428701207], length 240
04:01:00.075405 IP lamp-ubuntu-s-1vcpu-1gb-tor1-01.ssh > 198.211.111.194.46317: Flags [P.], seq 11191969:11192417, ack 448, win 502, options [nop,nop,TS val 3946700006 ecr 3428701207], length 448
04:01:00.075549 IP lamp-ubuntu-s-1vcpu-1gb-tor1-01.ssh > 198.211.111.194.46317: Flags [P.], seq 11192417:11192673, ack 448, win 502, options [nop,nop,TS val 3946700006 ecr 3428701207], length 256
04:01:00.075642 IP 198.211.111.194.46317 > lamp-ubuntu-s-1vcpu-1gb-tor1-01.ssh: Flags [.], ack 11170001, win 501, options [nop,nop,TS val 3428701208 ecr 3946699991], length 0
04:01:00.075836 IP lamp-ubuntu-s-1vcpu-1gb-tor1-01.ssh > 198.211.111.194.46317: Flags [P.], seq 11192673:11193105, ack 448, win 502, options [nop,nop,TS val 3946700006 ecr 3428701208], length 432
04:01:00.075982 IP 198.211.111.194.46317 > lamp-ubuntu-s-1vcpu-1gb-tor1-01.ssh: Flags [.], ack 11171457, win 501, options [nop,nop,TS val 3428701209 ecr 3946699992], length 0
04:01:00.076111 IP lamp-ubuntu-s-1vcpu-1gb-tor1-01.ssh > 198.211.111.194.46317: Flags [P.], seq 11193105:11193537, ack 448, win 502, options [nop,nop,TS val 3946700006 ecr 3428701209], length 432
04:01:00.076263 IP lamp-ubuntu-s-1vcpu-1gb-tor1-01.ssh > 198.211.111.194.46317: Flags [P.], seq 11193537:11193793, ack 448, win 502, options [nop,nop,TS val 3946700007 ecr 3428701209], length 256
04:01:00.076406 IP lamp-ubuntu-s-1vcpu-1gb-tor1-01.ssh > 198.211.111.194.46317: Flags [P.], seq 11193793:11194049, ack 448, win 502, options [nop,nop,TS val 3946700007 ecr 3428701209], length 256
04:01:00.076574 IP lamp-ubuntu-s-1vcpu-1gb-tor1-01.ssh > 198.211.111.194.46317: Flags [P.], seq 11194049:11194305, ack 448, win 502, options [nop,nop,TS val 3946700007 ecr 3428701209], length 256
04:01:00.076712 IP lamp-ubuntu-s-1vcpu-1gb-tor1-01.ssh > 198.211.111.194.46317: Flags [P.], seq 11194305:11194561, ack 448, win 502, options [nop,nop,TS val 3946700007 ecr 3428701209], length 256
04:01:00.076851 IP lamp-ubuntu-s-1vcpu-1gb-tor1-01.ssh > 198.211.111.194.46317: Flags [P.], seq 11194561:11194817, ack 448, win 502, options [nop,nop,TS val 3946700007 ecr 3428701209], length 256
04:01:00.077062 IP 198.211.111.194.46317 > lamp-ubuntu-s-1vcpu-1gb-tor1-01.ssh: Flags [.], ack 11172913, win 501, options [nop,nop,TS val 3428701210 ecr 3946699993], length 0
04:01:00.077168 IP lamp-ubuntu-s-1vcpu-1gb-tor1-01.ssh > 198.211.111.194.46317: Flags [P.], seq 11194817:11195073, ack 448, win 502, options [nop,nop,TS val 3946700008 ecr 3428701210], length 256
04:01:00.077308 IP lamp-ubuntu-s-1vcpu-1gb-tor1-01.ssh > 198.211.111.194.46317: Flags [P.], seq 11195073:11195505, ack 448, win 502, options [nop,nop,TS val 3946700008 ecr 3428701210], length 432
04:01:00.077451 IP lamp-ubuntu-s-1vcpu-1gb-tor1-01.ssh > 198.211.111.194.46317: Flags [P.], seq 11195505:11195761, ack 448, win 502, options [nop,nop,TS val 3946700008 ecr 3428701210], length 256
04:01:00.077508 IP 198.211.111.194.46317 > lamp-ubuntu-s-1vcpu-1gb-tor1-01.ssh: Flags [.], ack 11174449, win 501, options [nop,nop,TS val 3428701211 ecr 3946699994], length 0
04:01:00.077650 IP lamp-ubuntu-s-1vcpu-1gb-tor1-01.ssh > 198.211.111.194.46317: Flags [P.], seq 11195761:11196193, ack 448, win 502, options [nop,nop,TS val 3946700008 ecr 3428701211], length 432
