root@lamp-ubuntu-s-1vcpu-1gb-tor1-01:~# tcpdump -c 5 -i eth0
tcpdump: verbose output suppressed, use -v or -vv for full protocol decode
listening on eth0, link-type EN10MB (Ethernet), capture size 262144 bytes
03:19:21.385220 IP lamp-ubuntu-s-1vcpu-1gb-tor1-01.ssh > 162.243.190.66.37587: Flags [P.], seq 811841448:811841576, ack 896426647, win 502, options [nop,nop,TS val 30951764 ecr 1976434478], length 128
03:19:21.385353 IP lamp-ubuntu-s-1vcpu-1gb-tor1-01.ssh > 162.243.190.66.37587: Flags [P.], seq 128:192, ack 1, win 502, options [nop,nop,TS val 30951764 ecr 1976434478], length 64
03:19:21.385465 IP lamp-ubuntu-s-1vcpu-1gb-tor1-01.ssh > 162.243.190.66.37587: Flags [P.], seq 192:320, ack 1, win 502, options [nop,nop,TS val 30951764 ecr 1976434478], length 128
03:19:21.385550 IP lamp-ubuntu-s-1vcpu-1gb-tor1-01.ssh > 162.243.190.66.37587: Flags [P.], seq 320:384, ack 1, win 502, options [nop,nop,TS val 30951764 ecr 1976434478], length 64
03:19:21.385679 IP 162.243.190.66.37587 > lamp-ubuntu-s-1vcpu-1gb-tor1-01.ssh: Flags [.], ack 128, win 501, options [nop,nop,TS val 1976434491 ecr 30951764], length 0
5 packets captured
52 packets received by filter
15 packets dropped by kernel